Datasett hentet fra;https://hnygard.github.io/norsk-lovtidend/;@hallny / Norske-postlister.no;Kilde;https://lovdata.no/register/lovtidend;Data hentet;08.11.2025 09:16:20

kunngjort;dato;korttittel;url;title;ikrafttredelse;gjelder for;hjemmel;journalnr;type;endrer;departement;eØs/eu/schengen;rettet;publisert;
25.06.2024   kl. 12.05;LOV-2024-06-25-70;Endringslov til luftfartsloven;https://lovdata.no/dokument/LTI/lov/2024-06-25-70;Lov om endringer i luftfartsloven (ubemannet luftfart mv.);Kongen bestemmer;;;2024-0631;lov;LOV-1993-06-11-101;Samferdselsdepartementet;
25.06.2024   kl. 12.05;LOV-2024-06-25-69;Bærekraftige produkter-loven;https://lovdata.no/dokument/LTI/lov/2024-06-25-69;Lov om bærekraftige produkter og verdikjeder (bærekraftige produkter-loven);Kongen bestemmer;;;2024-0628;lov;;Klima- og miljødepartementet;
25.06.2024   kl. 12.05;LOV-2024-06-25-68;Endringslov til legemiddelloven og apotekloven;https://lovdata.no/dokument/LTI/lov/2024-06-25-68;Lov om endringer i legemiddelloven og apotekloven (styrket legemiddelberedskap m.m.);Kongen bestemmer;;;2024-0568;lov;LOV-1992-12-04-132, LOV-2000-06-02-39;Helse- og omsorgsdepartementet;
25.06.2024   kl. 12.05;LOV-2024-06-25-67;Lov om Statens fond i Tromsø;https://lovdata.no/dokument/LTI/lov/2024-06-25-67;Lov om Statens fond i Tromsø;Kongen bestemmer;;;2024-0694;lov;;Finansdepartementet;
25.06.2024   kl. 12.05;LOV-2024-06-25-66;Endringslov til suppleringsskatteloven;https://lovdata.no/dokument/LTI/lov/2024-06-25-66;Lov om endringar i suppleringsskatteloven;25.06.2024, inntektsåret 2024;;;2024-0673;lov;LOV-2024-01-12-1;Finansdepartementet;
25.06.2024   kl. 12.05;LOV-2024-06-25-65;Endringslov til lov om endringer i skatteloven;https://lovdata.no/dokument/LTI/lov/2024-06-25-65;Lov om endring i lov 20. desember 2023 nr. 98 om endringer i skatteloven;25.06.2024;;;2024-0672;lov;LOV-1999-03-26-14, LOV-2023-12-20-98;Finansdepartementet;
25.06.2024   kl. 12.05;LOV-2024-06-25-64;Endringslov til merverdiavgiftsloven;https://lovdata.no/dokument/LTI/lov/2024-06-25-64;Lov om endringar i merverdiavgiftsloven;25.06.2024, 01.07.2024;;;2024-0671;lov;LOV-2009-06-19-58;Finansdepartementet;
25.06.2024   kl. 12.05;LOV-2024-06-25-63;Endringslov til svalbardskatteloven;https://lovdata.no/dokument/LTI/lov/2024-06-25-63;Lov om endringar i svalbardskatteloven;25.06.2024, inntektsåret 2024;;;2024-0670;lov;LOV-1996-11-29-68;Finansdepartementet;
25.06.2024   kl. 12.05;LOV-2024-06-25-62;Endringslov til folketrygdloven;https://lovdata.no/dokument/LTI/lov/2024-06-25-62;Lov om endring i folketrygdloven;25.06.2024;;;2024-0669;lov;LOV-1997-02-28-19;Finansdepartementet;
25.06.2024   kl. 12.05;LOV-2024-06-25-61;Endringslov til skatteloven;https://lovdata.no/dokument/LTI/lov/2024-06-25-61;Lov om endringar i skatteloven;25.06.2024, inntektsåret 2024, 01.01.2025;;;2024-0668;lov;LOV-1999-03-26-14;Finansdepartementet;
25.06.2024   kl. 12.05;LOV-2024-06-25-60;Endringslov til finansmarkedslovgivningen;https://lovdata.no/dokument/LTI/lov/2024-06-25-60;Lov om endringer i finansmarkedslovgivningen (samleproposisjon);Kongen bestemmer;;;2024-0627;lov;LOV-2007-06-29-75, LOV-2011-11-25-44, LOV-2014-06-20-28, LOV-2015-04-10-17, LOV-2018-06-01-23, LOV-2019-03-01-2, LOV-2019-03-15-6, LOV-2022-12-16-90;Finansdepartementet;EØS-avtalen vedlegg IXdirektiv (EU) 2018/843,forordning (EU) 2015/2365,forordning (EU) 2019/463,forordning (EU) 2019/834,forordning (EU) 2022/858.;
25.06.2024   kl. 12.05;LOV-2024-06-25-59;Endringslov til folketrygdloven;https://lovdata.no/dokument/LTI/lov/2024-06-25-59;Lov om endring i folketrygdloven (styrking av fedres rett til foreldrepenger);Kongen bestemmer;;;2024-0626;lov;LOV-1997-02-28-19;Barne- og familiedepartementet;EØS-avtalens vedlegg XVIIInr. 31a (direktiv (EU) 2019/1158),EØS-komiteens beslutning nr. 74/2024.;
25.06.2024   kl. 12.05;LOV-2024-06-25-58;Lov om omdanning av Opplysningsvesenets fond til aksjeselskap;https://lovdata.no/dokument/LTI/lov/2024-06-25-58;Lov om omdanning av Opplysningsvesenets fond til aksjeselskap;25.06.2024, Kongen bestemmer;;;2024-0624;lov;LOV-2020-04-24-31, LOV-2021-06-18-98;Barne- og familiedepartementet;;
25.06.2024   kl. 12.05;LOV-2024-06-25-57;Endringslov til ekteskapsloven;https://lovdata.no/dokument/LTI/lov/2024-06-25-57;Lov om endringer i ekteskapsloven (forbud mot ekteskap mellom nære slektninger);25.06.2024, Kongen bestemmer;;;2024-0625;lov;LOV-1991-07-04-47, LOV-2021-06-11-63;Barne- og familiedepartementet;;
25.06.2024   kl. 12.05;LOV-2024-06-25-56;Endringslov til gjeldsordningsloven mv.;https://lovdata.no/dokument/LTI/lov/2024-06-25-56;Lov om endringer i gjeldsordningsloven mv. (effektivisering og forenkling av gjeldsordningsprosessen);Kongen bestemmer;;;2024-0623;lov;LOV-1992-07-17-99, LOV-2020-06-23-98;Barne- og familiedepartementet;;
25.06.2024   kl. 12.05;LOV-2024-06-25-55;Lov om lønnsnemndbehandling, Akademikerne, Unio;https://lovdata.no/dokument/LTI/lov/2024-06-25-55;Lov om lønnsnemndbehandling av arbeidstvisten mellom Akademikerne og staten v/ Digitaliserings- og forvaltningsdepartementet og arbeidstvisten mellom Unio og staten v/ Digitaliserings- og forvaltningsdepartementet i forbindelse med Statsoppgjøret 2024;25.06.2024, oppheves ved kjennelse i Rikslønnsnemnda;;;2024-0695;lov;;Arbeids- og inkluderingsdepartementet;;
25.06.2024   kl. 12.05;LOV-2024-06-25-54;Endringslov til integreringsloven, folketrygdloven mv;https://lovdata.no/dokument/LTI/lov/2024-06-25-54;Lov om endringer i integreringsloven, folketrygdloven og tannhelsetjenesteloven (innstramminger);Kongen bestemmer;;;2024-0629;lov;LOV-1983-06-03-54, LOV-1997-02-28-19, LOV-2020-11-06-127;Arbeids- og inkluderingsdepartementet;;
25.06.2024   kl. 12.05;LOV-2024-06-25-53;Endringslov til barnetrygdloven mv. (Ukraina);https://lovdata.no/dokument/LTI/lov/2024-06-25-53;Lov om endringer i barnetrygdloven og midlertidige endringer i lovverket som følge av ankomst av fordrevne fra Ukraina (videreføring m.m.);Kongen bestemmer, 01.07.2026;;;2024-0630;lov;LOV-1998-07-17-61, LOV-1999-03-26-17, LOV-1999-07-02-61, LOV-1999-07-02-63, LOV-2002-03-08-4, LOV-2002-06-21-45, LOV-2005-06-17-64, LOV-2008-06-27-71, LOV-2011-06-24-30, LOV-2020-11-06-127, LOV-2021-06-18-97, LOV-2023-06-09-30;Arbeids- og inkluderingsdepartementet;;
21.06.2024   kl. 12.10;LOV-2024-06-21-52;Endringslov til plan- og bygningsloven og åndsverkloven;https://lovdata.no/dokument/LTI/lov/2024-06-21-52;Lov om endringer i plan- og bygningsloven og åndsverkloven (plikt til innrapportering av grunnundersøkelser og naturfareutredninger til offentlige registre mv.);21.06.2024, Kongen bestemmer;;;2024-0570;lov;LOV-2008-06-27-71, LOV-2018-06-15-40;Kommunal- og distriktsdepartementet;;
21.06.2024   kl. 12.10;LOV-2024-06-21-51;Endringslov til valgloven;https://lovdata.no/dokument/LTI/lov/2024-06-21-51;Lov om endringer i valgloven (offentliggjøring av valgresultater og valgdagsmålinger på valgdagen);21.06.2024;;;2024-0569;lov;LOV-2023-06-16-62;Kommunal- og distriktsdepartementet;;
21.06.2024   kl. 12.10;LOV-2024-06-21-50;Midlertidig endringslov til utlendingsloven;https://lovdata.no/dokument/LTI/lov/2024-06-21-50;Lov om midlertidige endringer i utlendingsloven (beredskapshjemmel for innkvartering av asylsøkere);Kongen bestemmer, oppheves 01.07.2026;;;2024-0571;lov;LOV-2008-05-15-35;Justis- og beredskapsdepartementet;;
21.06.2024   kl. 12.10;LOV-2024-06-21-49;Endringslov til rettsgebyrloven;https://lovdata.no/dokument/LTI/lov/2024-06-21-49;Lov om endringar i rettsgebyrloven (justering av multiplikator for forliksklage og forkynning av betalingsoppmoding);01.07.2024;;;2024-0622;lov;LOV-1982-12-17-86;Justis- og beredskapsdepartementet;;
21.06.2024   kl. 12.10;LOV-2024-06-21-48;Endringslov til el-tilsynsloven;https://lovdata.no/dokument/LTI/lov/2024-06-21-48;Lov om endringer i el-tilsynsloven (hjemmel for gebyr for godkjenning av yrkeskvalifikasjoner mv.);Kongen bestemmer;;;2024-0621;lov;LOV-1929-05-24-4;Justis- og beredskapsdepartementet;;
21.06.2024   kl. 12.10;LOV-2024-06-21-47;Endringslov til grenseloven og utlendingsloven mv.;https://lovdata.no/dokument/LTI/lov/2024-06-21-47;Lov om endringer i grenseloven og utlendingsloven mv. (interoperabilitet og visuminformasjonssystemet mv.);21.06.2024, Kongen bestemmer;;;2024-0580;lov;LOV-1995-08-04-53, LOV-1999-07-16-66, LOV-2008-05-15-35, LOV-2018-04-20-8, LOV-2022-04-29-26, LOV-2023-12-20-110;Justis- og beredskapsdepartementet;Schengen-avtalenforordning (EU) 2019/817,forordning (EU) 2019/818,forordning (EU) 2021/1133,forordning (EU) 2021/1134,forordning (EU) 2021/1150,forordning (EU) 2021/1151.;
21.06.2024   kl. 12.10;LOV-2024-06-21-46;Endringslov til advokatloven mv.;https://lovdata.no/dokument/LTI/lov/2024-06-21-46;Lov om endringer i advokatloven mv. (overgangsregler mv.);21.06.2024;;;2024-0579;lov;LOV-1915-08-13-5, LOV-1967-02-10, LOV-1980-06-13-35, LOV-1981-05-22-25, LOV-1984-06-08-58, LOV-1988-05-13-26, LOV-2005-05-20-28, LOV-2005-06-17-85, LOV-2005-06-17-90, LOV-2007-06-29-73, LOV-2010-03-26-9, LOV-2016-05-27-14, LOV-2018-06-01-23, LOV-2022-05-12-28, LOV-2023-12-20-109;Justis- og beredskapsdepartementet;;
21.06.2024   kl. 12.10;LOV-2024-06-21-45;Endringslov til straffegjennomføringsloven;https://lovdata.no/dokument/LTI/lov/2024-06-21-45;Lov om endringer i straffegjennomføringsloven (erstatning for skader under pålagt organisert trening mv.);Kongen bestemmer;;;2024-0578;lov;LOV-2001-05-18-21;Justis- og beredskapsdepartementet;;
21.06.2024   kl. 12.10;LOV-2024-06-21-44;Endringslov til helsepersonelloven og helsetilsynsloven;https://lovdata.no/dokument/LTI/lov/2024-06-21-44;Lov om endringar i helsepersonelloven og helsetilsynsloven (administrative reaksjonar, karantenetid før søknad om ny autorisasjon mv.);Kongen fastset;;;2024-0567;lov;LOV-1999-07-02-64, LOV-2017-12-15-107;Helse- og omsorgsdepartementet;;
21.06.2024   kl. 12.10;LOV-2024-06-21-43;Endringslov til tannhelsetjenesteloven mv.;https://lovdata.no/dokument/LTI/lov/2024-06-21-43;Lov om endringar i tannhelsetjenesteloven mv. (rett til tannhelsetenester for unge vaksne, personar med rusmiddelavhengigheit mv.);Kongen fastset;;;2024-0566;lov;LOV-1983-06-03-54, LOV-1989-06-02-27, LOV-1992-12-04-132, LOV-1999-07-02-63, LOV-2018-06-22-76;Helse- og omsorgsdepartementet;;
21.06.2024   kl. 12.10;LOV-2024-06-21-42;Endringslov til regnskapsloven mv.;https://lovdata.no/dokument/LTI/lov/2024-06-21-42;Lov om endringer i regnskapsloven mv. (bærekraftsrapportering);Kongen bestemmer;;;2024-0575;lov;LOV-1991-08-30-71, LOV-1997-06-13-44, LOV-1997-06-13-45, LOV-1998-07-17-56, LOV-2003-06-06-38, LOV-2005-04-01-15, LOV-2007-06-29-75, LOV-2007-06-29-81, LOV-2015-04-10-17, LOV-2018-06-08-28, LOV-2020-11-20-128, LOV-2021-06-18-99;Finansdepartementet;Direktiv (EU) 2022/2464.;
21.06.2024   kl. 12.10;LOV-2024-06-21-41;Finanstilsynsloven;https://lovdata.no/dokument/LTI/lov/2024-06-21-41;Lov om Finanstilsynet (finanstilsynsloven);Kongen bestemmer;;;2024-0576;lov;LOV-1956-12-07-1, LOV-1989-06-16-69, LOV-1998-07-17-56, LOV-2001-06-15-59, LOV-2001-12-14-95, LOV-2007-06-29-73, LOV-2007-06-29-75, LOV-2015-04-10-17, LOV-2020-11-20-128, LOV-2020-12-18-146, LOV-2021-06-18-136, LOV-2021-12-22-163;Finansdepartementet;EØS-avtalen vedlegg IX,særlig nr. 1 (direktiv 2009/138),nr. 14 (direktiv 2013/36/EU),nr. 30 (direktiv 2009/65/EF)nr. 23b (direktiv (EU) 2015/849),nr. 31ba (direktiv 2014/65/EU).;
21.06.2024   kl. 12.10;LOV-2024-06-21-40;PRIIPs-loven;https://lovdata.no/dokument/LTI/lov/2024-06-21-40;Lov om nøkkelinformasjon om sammensatte og forsikringsbaserte investeringsprodukter (PRIIPs-loven);Kongen bestemmer;;;2024-0574;lov;LOV-2011-11-25-44, LOV-2014-06-20-28;Finansdepartementet;EØS-avtalen vedlegg IXnr. 31bg (forordning (EU) nr. 1286/2014 som endret ved forordning (EU) 2016/2340, (EU) 2019/1156 og (EU) 2021/2259);
21.06.2024   kl. 12.10;LOV-2024-06-21-39;Endringslov til lov om elektroniske tillitstjenester;https://lovdata.no/dokument/LTI/lov/2024-06-21-39;Lov om endringer i lov om elektroniske tillitstjenester (adgang til innhenting av opplysninger fra Folkeregisteret);21.06.2024;;;2024-0485;lov;LOV-2018-06-15-44;Digitaliserings- og forvaltningsdepartementet;;
14.06.2024   kl. 11.50;LOV-2024-06-14-38;Endringslov til brukthandellova;https://lovdata.no/dokument/LTI/lov/2024-06-14-38;Lov om endringer i brukthandellova (innskrenking av virkeområde);Kongen bestemmer;;;2024-0541;lov;LOV-1999-12-22-105;Nærings- og fiskeridepartementet;;
14.06.2024   kl. 11.50;LOV-2024-06-14-37;Endringslov til viltloven mv.;https://lovdata.no/dokument/LTI/lov/2024-06-14-37;Lov om endringer i viltloven mv. (endret betegnelse på organ i viltforvaltningen og oppheving av lovvedtak om nydyrking og nedbygging av myr);Kongen bestemmer;;;2024-0540;lov;LOV-1981-05-29-38, LOV-2021-06-11-82;Landbruks- og matdepartementet;;
14.06.2024   kl. 11.50;LOV-2024-06-14-36;Endringslov til opplæringslova og privatskolelova;https://lovdata.no/dokument/LTI/lov/2024-06-14-36;Lov om endringer i opplæringslova og privatskolelova (kompetansekrav, faglig ansvar og bruk av fysisk inngripen for å avverge skade m.m.);14.06.2024, Kongen fastsetter;;;2024-0573;lov;LOV-2003-07-04-84, LOV-2023-06-09-30;Kunnskapsdepartementet;;
14.06.2024   kl. 11.50;LOV-2024-06-14-35;Endringslov til barnehageloven;https://lovdata.no/dokument/LTI/lov/2024-06-14-35;Lov om endringer i barnehageloven (unntak fra kravet om selvstendig rettssubjekt og forbudet mot annen virksomhet m.m.);Kongen bestemmer;;;2024-0565;lov;LOV-2005-06-17-64;Kunnskapsdepartementet;;
14.06.2024   kl. 11.50;LOV-2024-06-14-34;Endringslov til privatskolelova;https://lovdata.no/dokument/LTI/lov/2024-06-14-34;Lov om endringer i privatskolelova (ny tilskuddsmodell for private grunnskoler);Kongen bestemmer;;;2024-0564;lov;LOV-2003-07-04-84;Kunnskapsdepartementet;;
14.06.2024   kl. 11.50;LOV-2024-06-14-33;Endringslov til diskrimineringsombudsloven og likestillings- og diskrimineringsloven;https://lovdata.no/dokument/LTI/lov/2024-06-14-33;Lov om endringer i diskrimineringsombudsloven og likestillings- og diskrimineringsloven (presisering av diskrimineringsombudsloven § 7 og likestillings- og diskrimineringsloven §§ 10 og 33);Kongen bestemmer;;;2024-0572;lov;LOV-2017-06-16-50, LOV-2017-06-16-51;Kultur- og likestillingsdepartementet;;
14.06.2024   kl. 11.50;LOV-2024-06-14-32;Endringslov til energiloven mv.;https://lovdata.no/dokument/LTI/lov/2024-06-14-32;Lov om endringer i energiloven mv. (tiltak for et mer forbrukervennlig strømmarked);Kongen bestemmer;;;2024-0577;lov;LOV-1990-06-29-50, LOV-2002-06-21-34, LOV-2009-01-09-2;Energidepartementet;;
14.06.2024   kl. 11.50;LOV-2024-06-14-31;Endringslov til arbeidsmiljøloven mv.;https://lovdata.no/dokument/LTI/lov/2024-06-14-31;Lov om endringer i arbeidsmiljøloven mv. (rammer for overtredelsesgebyr);Kongen bestemmer;;;2024-0490;lov;LOV-2004-12-10-76, LOV-2005-06-17-62;Arbeids- og inkluderingsdepartementet;;
07.06.2024   kl. 11.45;LOV-2024-06-07-30;Endringslov til svalbardmiljøloven;https://lovdata.no/dokument/LTI/lov/2024-06-07-30;Lov om endringer i svalbardmiljøloven (beskyttelse av sjøfugl og isbjørn, overtredelsesgebyr, opprydding m.m.);Kongen bestemmer;;;2024-0491;lov;LOV-2001-06-15-79;Klima- og miljødepartementet;;
07.06.2024   kl. 11.45;LOV-2024-06-07-29;Endringslov til finansavtaleloven mv.;https://lovdata.no/dokument/LTI/lov/2024-06-07-29;Lov om endringer i finansavtaleloven mv. (forbrukeres rett til kontant betaling mv.);Kongen bestemmer;;;2024-0539;lov;LOV-1993-06-11-100, LOV-2002-06-21-45, LOV-2020-12-18-146;Justis- og beredskapsdepartementet;;
07.06.2024   kl. 11.45;LOV-2024-06-07-28;Endringslov til politiloven;https://lovdata.no/dokument/LTI/lov/2024-06-07-28;Lov om endringer i politiloven;Kongen bestemmer;;;2024-0489;lov;LOV-1995-08-04-53;Justis- og beredskapsdepartementet;;
31.05.2024   kl. 11.45;LOV-2024-05-31-27;Endringslov til utdanningsstøtteloven;https://lovdata.no/dokument/LTI/lov/2024-05-31-27;Lov om endringer i utdanningsstøtteloven (beregning av rente på utdanningslån under utdanningen for særlige ordninger mv.);Kongen bestemmer;;;2024-0486;lov;LOV-2005-06-03-37;Kunnskapsdepartementet;;
31.05.2024   kl. 11.45;LOV-2024-05-31-26;Endringslov til fagskoleloven mv;https://lovdata.no/dokument/LTI/lov/2024-05-31-26;Lov om endringer i fagskoleloven (institusjonsakkreditering for fagskoler mv.);31.05.2024, Kongen bestemmer;;;2024-0487;lov;LOV-2018-06-08-28, LOV-2024-03-08-9;Kunnskapsdepartementet;;
31.05.2024   kl. 11.45;LOV-2024-05-31-25;Endringslov til straffeloven mv.;https://lovdata.no/dokument/LTI/lov/2024-05-31-25;Lov om endringer i straffeloven mv. (påvirkning fra fremmed etterretning);Kongen bestemmer;;;2024-0488;lov;LOV-1981-05-22-23, LOV-1981-05-22-25, LOV-1995-08-04-53, LOV-2005-05-20-28, LOV-2016-05-27-14;Justis- og beredskapsdepartementet;;
24.05.2024   kl. 11.40;LOV-2024-05-24-24;Endringslov til lov om krigspensjonering for militærpersoner mv.;https://lovdata.no/dokument/LTI/lov/2024-05-24-24;Lov om endringer i lov om krigspensjonering for militærpersoner og lov om krigspensjonering for hjemmestyrkepersonell og sivilpersoner (refusjon av egenandeler ved varig innleggelse i institusjon i utlandet);01.06.2024;;;2024-0462;lov;LOV-1946-12-13-21, LOV-1946-12-13-22;Arbeids- og inkluderingsdepartementet;;
24.05.2024   kl. 11.40;LOV-2024-05-24-23;Endringslov til trygderettsloven;https://lovdata.no/dokument/LTI/lov/2024-05-24-23;Lov om endringer i trygderettsloven (rettens sammensetning, aktiv saksstyring og krav til kjennelser);Kongen bestemmer;;;2024-0442;lov;LOV-1966-12-16-9;Arbeids- og inkluderingsdepartementet;;
14.05.2024   kl. 10.40;LOV-2024-05-14-22;Endringslov til pengespilloven mv.;https://lovdata.no/dokument/LTI/lov/2024-05-14-22;Lov om endringer i pengespilloven mv. (DNS-blokkering av nettsteder som tilbyr pengespill som ikke har tillatelse i Norge);Kongen bestemmer;;;2024-0329;lov;LOV-2013-06-21-97, LOV-2020-12-18-153, LOV-2022-03-18-12;Kultur- og likestillingsdepartementet;;
14.05.2024   kl. 10.40;LOV-2024-05-14-21;Endringslov til kontantstøtteloven og folketrygdloven;https://lovdata.no/dokument/LTI/lov/2024-05-14-21;Lov om endringer i kontantstøtteloven og folketrygdloven (justering av kontantstøtteperioden og forlengelse av foreldrepengeperioden ved 80 prosent dekning);Kongen bestemmer;;;2024-0330;lov;LOV-1997-02-28-19, LOV-1998-06-26-41;Barne- og familiedepartementet;;
03.05.2024   kl. 11.45;LOV-2024-05-03-20;Endringslov til helse- og omsorgstjenesteloven;https://lovdata.no/dokument/LTI/lov/2024-05-03-20;Lov om endringar i helse- og omsorgstjenesteloven (overføring av ansvaret for helsetilbodet ved utlendingsinternat);Kongen fastset;;;2024-0372;lov;LOV-2011-06-24-30;Helse- og omsorgsdepartementet;;
19.04.2024   kl. 11.45;LOV-2024-04-19-19;Endringslov til utlendingsloven;https://lovdata.no/dokument/LTI/lov/2024-04-19-19;Lov om endringer i utlendingsloven (utvisning på grunn av omgåelsesekteskap);Kongen bestemmer;;;2024-0371;lov;LOV-2008-05-15-35;Justis- og beredskapsdepartementet;;
19.04.2024   kl. 11.45;LOV-2024-04-19-18;Lov om lønnsnemndbehandling Parat og NHO Luftfart (CHC Helikopter Service AS);https://lovdata.no/dokument/LTI/lov/2024-04-19-18;Lov om lønnsnemndbehandling av arbeidstvisten mellom Parat og NHO Luftfart/CHC Helikopter Service AS vedrørende opprettelse av tariffavtale for piloter i CHC Helikopter Service AS;19.04.2024;;;2024-0334;lov;;Arbeids- og inkluderingsdepartementet;;
12.04.2024   kl. 11.45;LOV-2024-04-12-17;Endringslov til foretakslovgivningen mv.;https://lovdata.no/dokument/LTI/lov/2024-04-12-17;Lov om endringer i foretakslovgivningen mv. (utlevering av fødsels- og d-nummer, registrering av enkeltpersonforetak, krav til foretaksnavn, retningslinjer for godtgjørelse mv.);Kongen bestemmer;;;2024-0335;lov;LOV-1985-06-21-78, LOV-1985-06-21-79, LOV-1994-06-03-15, LOV-1997-06-13-45, LOV-2001-06-15-59;Nærings- og fiskeridepartementet;;
12.04.2024   kl. 11.45;LOV-2024-04-12-16;Lov om informasjonstilgang for gransking av utenlandsadopsjoner til Norge;https://lovdata.no/dokument/LTI/lov/2024-04-12-16;Lov om informasjonstilgang m.m. for utvalget som skal granske utenlandsadopsjoner til Norge;12.04.2024;;;2024-0331;lov;;Barne- og familiedepartementet;;
12.04.2024   kl. 11.45;LOV-2024-04-12-15;Endringslov til lov om Statens pensjonskasse mv.;https://lovdata.no/dokument/LTI/lov/2024-04-12-15;Lov om endringer i lov om Statens pensjonskasse og enkelte andre lover (styrket insentiv til å jobbe lenger);Kongen bestemmer;;;2024-0333;lov;LOV-1949-07-28-26, LOV-1953-06-26-11, LOV-1962-06-22-12, LOV-1966-05-06, LOV-1982-05-21-25;Arbeids- og inkluderingsdepartementet;;
12.04.2024   kl. 11.45;LOV-2024-04-12-14;Endringslov til lov om avtalefestet pensjon mv.;https://lovdata.no/dokument/LTI/lov/2024-04-12-14;Lov om endringer i lov om avtalefestet pensjon for medlemmer av Statens pensjonskasse og enkelte andre lover (ny avtalefestet pensjon);Kongen bestemmer;;;2024-0332;lov;LOV-1948-12-03-7, LOV-1949-07-28-26, LOV-1953-06-26-11, LOV-1957-07-06-26, LOV-1962-06-22-12, LOV-1994-07-01-49, LOV-1997-02-28-19, LOV-2010-02-19-5, LOV-2010-06-25-28;Arbeids- og inkluderingsdepartementet;;
22.03.2024   kl. 11.50;LOV-2024-03-22-13;Endringslov til finansforetaksloven;https://lovdata.no/dokument/LTI/lov/2024-03-22-13;Lov om endringer i finansforetaksloven (utdelinger fra finansforetak mv.);Kongen bestemmer;;;2024-0256;lov;LOV-2015-04-10-17;Finansdepartementet;;
22.03.2024   kl. 11.50;LOV-2024-03-22-12;Endringslov til vassdragsreguleringsloven og energiloven;https://lovdata.no/dokument/LTI/lov/2024-03-22-12;Lov om endringer i vassdragsreguleringsloven og energiloven (styrking av forsyningssikkerheten);Kongen bestemmer;;;2024-0230;lov;LOV-1917-12-14-17, LOV-1990-06-29-50;Energidepartementet;;
22.03.2024   kl. 11.50;LOV-2024-03-22-11;Endringslov pga. nye navn på Olje- og energidepartementet, Petroleumstilsynet og Oljedirektoratet;https://lovdata.no/dokument/LTI/lov/2024-03-22-11;Lov om endringer i lovgivningen som følge av nye navn på Olje- og energidepartementet, Petroleumstilsynet og Oljedirektoratet;Kongen bestemmer;;;2024-0231;lov;LOV-1973-03-09-14, LOV-1990-12-21-72, LOV-1993-06-04-58, LOV-2008-05-15-35, LOV-2016-05-27-14, LOV-2016-06-17-73, LOV-2019-03-22-7;Energidepartementet;;
15.03.2024   kl. 11.45;LOV-2024-03-15-10;Endringslov til yrkestransportlova;https://lovdata.no/dokument/LTI/lov/2024-03-15-10;Lov om endringer i yrkestransportlova (sentraltilknytningsplikt og justering av løyveplikten for drosje);Kongen bestemmer;;;2024-0232;lov;LOV-2002-06-21-45;Samferdselsdepartementet;;15.08.2024 (se kunngjøring av beriktiget versjon av loven i kunngj. 15. august 2024 nr. 1960);
08.03.2024   kl. 11.45;LOV-2024-03-08-9;Universitets- og høyskoleloven;https://lovdata.no/dokument/LTI/lov/2024-03-08-9;Lov om universiteter og høyskoler (universitets- og høyskoleloven);Kongen bestemmer;;;2024-0166;lov;LOV-2005-04-01-15, LOV-2017-04-28-23, LOV-2018-06-08-28, LOV-2023-06-09-30;Kunnskapsdepartementet;;;
02.02.2024   kl. 11.40;LOV-2024-02-02-8;Endringslov til matloven og kosmetikklova;https://lovdata.no/dokument/LTI/lov/2024-02-02-8;Lov om endringer i matloven og kosmetikklova (behandling av personopplysninger og smittesporing m.m.);Kongen bestemmer;;;2024-0060;lov;LOV-2003-12-19-124, LOV-2005-12-21-126;Helse- og omsorgsdepartementet;;;
12.01.2024   kl. 14.55;LOV-2024-01-12-7;Endringslov til skatteforvaltningsloven;https://lovdata.no/dokument/LTI/lov/2024-01-12-7;Lov om endringer i skatteforvaltningsloven;01.01.2024;;;2024-0013;lov;LOV-2016-05-27-14;Finansdepartementet;;;
12.01.2024   kl. 14.55;LOV-2024-01-12-6;Endringslov til merverdiavgiftsloven;https://lovdata.no/dokument/LTI/lov/2024-01-12-6;Lov om endringer i merverdiavgiftsloven;01.01.2024;;;2024-0012;lov;LOV-2009-06-19-58;Finansdepartementet;;;
12.01.2024   kl. 14.55;LOV-2024-01-12-5;Endringslov til skattebetalingsloven;https://lovdata.no/dokument/LTI/lov/2024-01-12-5;Lov om endringer i skattebetalingsloven;01.01.2024;;;2024-0011;lov;LOV-2005-06-17-67;Finansdepartementet;;;
12.01.2024   kl. 14.55;LOV-2024-01-12-4;Endringslov til skatteloven;https://lovdata.no/dokument/LTI/lov/2024-01-12-4;Lov om endringer i skatteloven;01.01.2024;;;2024-0010;lov;LOV-1999-03-26-14;Finansdepartementet;;;
12.01.2024   kl. 14.55;LOV-2024-01-12-3;Endringslov til smittevernloven og helseberedskapsloven;https://lovdata.no/dokument/LTI/lov/2024-01-12-3;Lov om endringer i smittevernloven og helseberedskapsloven (isolering og smittekarantene m.m.);Kongen bestemmer;;;2024-0007;lov;LOV-1994-08-05-55, LOV-2000-06-23-56;Helse- og omsorgsdepartementet;;;
12.01.2024   kl. 14.55;LOV-2024-01-12-2;Endringslov til skatteloven;https://lovdata.no/dokument/LTI/lov/2024-01-12-2;Lov om endringer i skatteloven;12.01.2024 med virkning fra og med inntektsåret 2024, Kongen bestemmer;;;2024-0008;lov;LOV-1999-03-26-14;Finansdepartementet;;;
12.01.2024   kl. 14.55;LOV-2024-01-12-1;Suppleringsskatteloven;https://lovdata.no/dokument/LTI/lov/2024-01-12-1;Lov om suppleringsskatt på underbeskattet inntekt i konsern (suppleringsskatteloven);12.01.2024 med virkning fra og med inntektsåret 2024;;;2024-0009;lov;;Finansdepartementet;;;
17.03.2023   kl. 11.40;LOV-2023-03-17-3;Endringslov til arbeidsmiljøloven mv.;https://lovdata.no/dokument/LTI/lov/2023-03-17-3;Lov om endringer i arbeidsmiljøloven mv. (arbeidstakerbegrepet og arbeidsgiveransvar i konsern);Kongen bestemmer;;;2023-0240;lov;LOV-1988-04-29-21, LOV-2012-01-27-9, LOV-2005-06-17-62;Arbeids- og inkluderingsdepartementet;;;
03.03.2023   kl. 11.40;LOV-2023-03-03-2;Endringslov til helselovgivningen;https://lovdata.no/dokument/LTI/lov/2023-03-03-2;Lov om endringer i helselovgivningen (organisering av klagenemndene, behandling av personopplysninger i pasientskadesaker m.m.);Kongen bestemmer;;;2023-0192;lov;LOV-1997-02-28-19, LOV-1999-07-02-63, LOV-1999-07-02-64, LOV-2001-06-15-53;Helse- og omsorgsdepartementet;;;
27.01.2023   kl. 11.40;LOV-2023-01-27-1;Endringslov til brann- og eksplosjonsvernloven;https://lovdata.no/dokument/LTI/lov/2023-01-27-1;Lov om endringer i brann- og eksplosjonsvernloven (etablering av fagskole for brann- og redningspersonell mv.);Kongen bestemmer;;;2023-0039;lov;LOV-2002-06-14-20;Justis- og beredskapsdepartementet;;;
20.12.2022   kl. 11.10;LOV-2022-12-20-122;Endringslov til SE-loven og SCE-loven mv.;https://lovdata.no/dokument/LTI/lov/2022-12-20-122;Lov om endringer i lov om europeiske selskaper (SE-loven) og lov om europeiske samvirkeforetak (SCE-loven) mv. (forskriftshjemler for saksbehandlingsregler);20.12.2022;;;2022-1637;lov;LOV-1930-03-14, LOV-1985-06-21-83, LOV-1986-06-20-35, LOV-1987-06-12-48, LOV-1997-06-13-44, LOV-1997-06-13-45, LOV-2005-04-01-14, LOV-2006-06-30-50, LOV-2006-08-18-61, LOV-2007-02-16-9, LOV-2007-06-29-81, LOV-2013-06-21-102;Nærings- og fiskeridepartementet;EØS-avtalen vedlegg XXII(forordning (EU) 2020/699).;;
20.12.2022   kl. 11.10;LOV-2022-12-20-121;Lov om kommunenes ansvar på det boligsosiale feltet;https://lovdata.no/dokument/LTI/lov/2022-12-20-121;Lov om kommunenes ansvar på det boligsosiale feltet;Kongen bestemmer;;;2022-1644;lov;LOV-2009-12-18-131, LOV-2011-06-24-30;Kommunal- og distriktsdepartementet;;;
20.12.2022   kl. 11.10;LOV-2022-12-20-120;Endringslov til utlendingsloven;https://lovdata.no/dokument/LTI/lov/2022-12-20-120;Lov om endringer i utlendingsloven (visitasjon og undersøkelse i forbindelse med registrering av søknad om beskyttelse mv.);Kongen bestemmer;;;2022-1753;lov;LOV-2008-05-15-35;Justis- og beredskapsdepartementet;;;
20.12.2022   kl. 11.10;LOV-2022-12-20-119;Endringslov til EOS-kontrolloven;https://lovdata.no/dokument/LTI/lov/2022-12-20-119;Lov om endringer i EOS-kontrolloven;01.01.2023;;;2022-1641;lov;LOV-1995-02-03-7;Justis- og beredskapsdepartementet;;;
20.12.2022   kl. 11.10;LOV-2022-12-20-118;Lov om informasjonstilgang m.m. for Koronautvalget mv.;https://lovdata.no/dokument/LTI/lov/2022-12-20-118;Lov om informasjonstilgang m.m. for Koronautvalget, og endringer i voldserstatningsloven (ny forskriftshjemmel);20.12.2022;;;2022-1752;lov;LOV-2022-06-17-57;Justis- og beredskapsdepartementet;;;
20.12.2022   kl. 11.10;LOV-2022-12-20-117;Endringslov til NIM-loven;https://lovdata.no/dokument/LTI/lov/2022-12-20-117;Lov om endringer i lov om Norges nasjonale institusjon for menneskerettigheter;01.01.2023;;;2022-1640;lov;LOV-2015-05-22-33, FOR-2015-04-30-1913;Justis- og beredskapsdepartementet;;;
20.12.2022   kl. 11.10;LOV-2022-12-20-116;Endringslov til patentloven;https://lovdata.no/dokument/LTI/lov/2022-12-20-116;Lov om endringer i patentloven (unntak fra beskyttelse ved eksport til tredjeland mv.);Kongen bestemmer;;;2022-1638;lov;LOV-1967-12-15-9;Justis- og beredskapsdepartementet;EØS-avtalen vedlegg XVIIforordning (EU) 2019/933.;;
20.12.2022   kl. 11.10;LOV-2022-12-20-115;Endringslov til lovgjevinga (kjønnsnøytral tittel på Sivilombodsmannen);https://lovdata.no/dokument/LTI/lov/2022-12-20-115;Lov om endringar i lovgjevinga som følgje av innføring av ny kjønnsnøytral tittel på Sivilombodsmannen;20.12.2022;;;2022-1639;lov;LOV-1950-12-15-7, LOV-1967-02-10, LOV-1979-05-18-18, LOV-1980-06-13-35, LOV-1989-06-16-65, LOV-1992-12-04-126, LOV-1999-07-02-62, LOV-1999-07-02-64, LOV-2006-05-19-16, LOV-2016-05-27-14, LOV-2017-06-16-50, LOV-2017-06-16-67, LOV-2020-06-19-80, LOV-2021-05-21-42;Justis- og beredskapsdepartementet;;;
20.12.2022   kl. 11.10;LOV-2022-12-20-114;Endringslov til lov om Stortingets ombudsnemnd for Forsvaret;https://lovdata.no/dokument/LTI/lov/2022-12-20-114;Lov om endringer i lov om Stortingets ombudsnemnd for Forsvaret;01.01.2023;;;2022-1642;lov;LOV-2021-06-18-115;Forsvarsdepartementet;;;
20.12.2022   kl. 11.10;LOV-2022-12-20-113;Endringslov til forsvarsloven;https://lovdata.no/dokument/LTI/lov/2022-12-20-113;Lov om endringer i forsvarsloven (utvidet adgang til å inngå kontrakt om tjenesteplikt mv.);Kongen bestemmer;;;2022-1645;lov;LOV-2016-08-12-77;Forsvarsdepartementet;;;
20.12.2022   kl. 11.10;LOV-2022-12-20-112;Endringslov til skatteloven;https://lovdata.no/dokument/LTI/lov/2022-12-20-112;Lov om endringer i skatteloven (endret formuesverdsetting av akvakulturtillatelser for inntektsåret 2022);20.12.2022, med virkning for inntektsåret 2022;;;2022-1768;lov;LOV-1999-03-26-14;Finansdepartementet;;;
20.12.2022   kl. 11.10;LOV-2022-12-20-111;Endringslov til vareførselsloven;https://lovdata.no/dokument/LTI/lov/2022-12-20-111;Lov om endringer i vareførselsloven;20.12.2022;;;2022-1767;lov;LOV-2022-03-11-9;Finansdepartementet;;;
20.12.2022   kl. 11.10;LOV-2022-12-20-110;Endringslov til tollavgiftsloven;https://lovdata.no/dokument/LTI/lov/2022-12-20-110;Lov om endringer i tollavgiftsloven;20.12.2022;;;2022-1766;lov;LOV-2005-06-17-67, LOV-2009-06-19-58, LOV-2022-03-11-8;Finansdepartementet;;;
20.12.2022   kl. 11.10;LOV-2022-12-20-109;Endringslov til SI-loven;https://lovdata.no/dokument/LTI/lov/2022-12-20-109;Lov om endring i SI-loven;20.12.2022;;;2022-1765;lov;LOV-2013-01-11-3;Finansdepartementet;;;
20.12.2022   kl. 11.10;LOV-2022-12-20-108;Endringslov til merverdiavgiftsloven;https://lovdata.no/dokument/LTI/lov/2022-12-20-108;Lov om endringer i merverdiavgiftsloven;01.01.2023;;;2022-1764;lov;LOV-2009-06-19-58;Finansdepartementet;;;
20.12.2022   kl. 11.10;LOV-2022-12-20-107;Endringslov til skattebetalingsloven;https://lovdata.no/dokument/LTI/lov/2022-12-20-107;Lov om endringer i skattebetalingsloven;20.12.2022;;;2022-1763;lov;LOV-2005-06-17-67;Finansdepartementet;;;
20.12.2022   kl. 11.10;LOV-2022-12-20-106;Endringslov til innskuddspensjonsloven;https://lovdata.no/dokument/LTI/lov/2022-12-20-106;Lov om endring i innskuddspensjonsloven;20.12.2022, med virkning fra og med inntektsåret 2023;;;2022-1762;lov;LOV-2000-11-24-81;Finansdepartementet;;;
20.12.2022   kl. 11.10;LOV-2022-12-20-105;Endringslov til skatteloven;https://lovdata.no/dokument/LTI/lov/2022-12-20-105;Lov om endringer i skatteloven;20.12.2022, med virkning fra og med inntektsåret 2022, inntektsåret 2023, 06.10.2022, 29.11.2022, 01.03.2023;;;2022-1761;lov;LOV-1999-03-26-14;Finansdepartementet;;;
20.12.2022   kl. 11.10;LOV-2022-12-20-104;Endringslov til folketrygdloven;https://lovdata.no/dokument/LTI/lov/2022-12-20-104;Lov om endringer i folketrygdloven;20.12.2022, med virkning fra og med inntektsåret 2023;;;2022-1760;lov;LOV-1997-02-28-19;Finansdepartementet;;;
20.12.2022   kl. 11.10;LOV-2022-12-20-103;Endringslov til petroleumsskatteloven;https://lovdata.no/dokument/LTI/lov/2022-12-20-103;Lov om endringer i petroleumsskatteloven;20.12.2022, med delvis virkning fra og med inntektsåret 2023;;;2022-1759;lov;LOV-1975-06-13-35;Finansdepartementet;;;
20.12.2022   kl. 11.10;LOV-2022-12-20-102;Endringslov til eigedomsskattelova;https://lovdata.no/dokument/LTI/lov/2022-12-20-102;Lov om endringer i eigedomsskattelova;20.12.2022, med virkning fra og med skatteåret 2023;;;2022-1758;lov;LOV-1975-06-06-29;Finansdepartementet;;;
20.12.2022   kl. 11.10;LOV-2022-12-20-101;Endringslov til allmenngjøringsloven;https://lovdata.no/dokument/LTI/lov/2022-12-20-101;Lov om endringer i allmenngjøringsloven (adgang til å gi forskrift om oppdragstakers dokumentasjonsplikt);Kongen bestemmer;;;2022-1531;lov;LOV-1993-06-04-58;Arbeids- og inkluderingsdepartementet;;;
20.12.2022   kl. 11.10;LOV-2022-12-20-100;Endringslov til folketrygdlova og enkelte andre lover;https://lovdata.no/dokument/LTI/lov/2022-12-20-100;Lov om endringar i folketrygdlova og enkelte andre lover (oppfølging av forslag i statsbudsjettet 2023);20.12.2022, 01.01.2023;;;2022-1755;lov;LOV-1949-07-28-26, LOV-1953-06-26-11, LOV-1962-06-22-12, LOV-1973-12-14-61, LOV-1997-02-28-19, LOV-2010-02-19-5, LOV-2010-06-25-28;Arbeids- og inkluderingsdepartementet;;;
20.12.2022   kl. 11.10;LOV-2022-12-20-99;Endringslov til arbeidsmiljøloven m.m.;https://lovdata.no/dokument/LTI/lov/2022-12-20-99;Lov om endringer i arbeidsmiljøloven m.m. (inn- og utleie fra bemanningsforetak);Kongen bestemmer;;;2022-1757;lov;LOV-2004-12-10-76, LOV-2005-06-17-62, LOV-2017-06-16-67;Arbeids- og inkluderingsdepartementet;;;
20.12.2022   kl. 11.10;LOV-2022-12-20-98;Endringslov til folketrygdloven og arbeidsmiljøloven;https://lovdata.no/dokument/LTI/lov/2022-12-20-98;Lov om endringer i folketrygdloven (kapittel 8 og 9) og arbeidsmiljøloven;Kongen bestemmer;;;2022-1756;lov;LOV-1997-02-28-19, LOV-2005-06-17-62;Arbeids- og inkluderingsdepartementet;;;
20.12.2022   kl. 11.10;LOV-2022-12-20-97;Lov om informasjonstilgang m.m. for Ekstremismekommisjonen;https://lovdata.no/dokument/LTI/lov/2022-12-20-97;Lov om informasjonstilgang m.m. for Ekstremismekommisjonen;20.12.2022;;;2022-1754;lov;;Arbeids- og inkluderingsdepartementet;;;
16.12.2022   kl. 13.00;LOV-2022-12-16-96;Endringslov til havenergilova;https://lovdata.no/dokument/LTI/lov/2022-12-16-96;Lov om endringar i havenergilova (utlysing og tildeling av areal);Kongen fastset;;;2022-1634;lov;LOV-2010-06-04-21;Olje- og energidepartementet;;;
16.12.2022   kl. 13.00;LOV-2022-12-16-95;Endringslov til strømstønadsloven;https://lovdata.no/dokument/LTI/lov/2022-12-16-95;Lov om endringer i midlertidig lov om stønad til husholdninger som følge av ekstraordinære strømutgifter (forlenget strømstønad);Straks;;;2022-1646;lov;LOV-2021-12-22-170;Olje- og energidepartementet;;;
16.12.2022   kl. 13.00;LOV-2022-12-16-94;Endringslov til konkurranseloven m.m.;https://lovdata.no/dokument/LTI/lov/2022-12-16-94;Lov om endringer i konkurranseloven m.m. (unntak fra offentleglova og beregning av renter);Kongen bestemmer;;;2022-1566;lov;LOV-1967-12-15-9, LOV-2004-03-05-12, LOV-2022-03-04-7;Nærings- og fiskeridepartementet;;;
16.12.2022   kl. 13.00;LOV-2022-12-16-93;Endringslov til stiftelsesloven;https://lovdata.no/dokument/LTI/lov/2022-12-16-93;Lov om endringer i stiftelsesloven (opphevelse av boligstiftelser opprettet av kommuner);Kongen bestemmer;;;2022-1565;lov;LOV-2001-06-15-59;Nærings- og fiskeridepartementet;;;
16.12.2022   kl. 13.00;LOV-2022-12-16-92;Endringslov til pasient- og brukerrettighetsloven og spesialisthelsetjenesteloven;https://lovdata.no/dokument/LTI/lov/2022-12-16-92;Lov om endringer i pasient- og brukerrettighetsloven og spesialisthelsetjenesteloven (avvikling av godkjenningsordningen i fritt behandlingsvalg);Kongen bestemmer;;;2022-1643;lov;LOV-1999-07-02-61, LOV-1999-07-02-63;Helse- og omsorgsdepartementet;;;
16.12.2022   kl. 13.00;LOV-2022-12-16-91;Låneformidlingsloven;https://lovdata.no/dokument/LTI/lov/2022-12-16-91;Lov om låneformidling (låneformidlingsloven);Kongen bestemmer;;;2022-1636;lov;LOV-2015-04-10-17, LOV-2018-06-01-23, LOV-2020-12-18-146;Finansdepartementet;;;
16.12.2022   kl. 13.00;LOV-2022-12-16-90;Regnskapsførerloven;https://lovdata.no/dokument/LTI/lov/2022-12-16-90;Lov om regnskapsførere (regnskapsførerloven);Kongen bestemmer;;;2022-1635;lov;LOV-1956-12-07-1, LOV-1985-06-21-78, LOV-1993-06-18-109, LOV-1997-06-13-44, LOV-1997-06-13-45, LOV-2001-06-15-59, LOV-2018-06-01-23, LOV-2022-01-28-2;Finansdepartementet;;;
16.12.2022   kl. 13.00;LOV-2022-12-16-89;Lov om lønnsnemndbehandling (Utdanningsforbundet mv. og KS);https://lovdata.no/dokument/LTI/lov/2022-12-16-89;Lov om lønnsnemndbehandling av arbeidstvistene mellom Utdanningsforbundet, Skolenes landsforbund og Norsk Lektorlag og KS i forbindelse med hovedoppgjøret i 2022;16.12.2022;;;2022-1567;lov;;Arbeids- og inkluderingsdepartementet;;;
09.12.2022   kl. 11.40;LOV-2022-12-09-88;Endringslov til arbeidsmiljøloven;https://lovdata.no/dokument/LTI/lov/2022-12-09-88;Lov om endringer i arbeidsmiljøloven (styrking av retten til heltid);Kongen bestemmer;;;2022-1530;lov;LOV-2005-06-17-62;Arbeids- og inkluderingsdepartementet;;;
02.12.2022   kl. 11.45;LOV-2022-12-02-87;Endringslov til plan- og bygningsloven;https://lovdata.no/dokument/LTI/lov/2022-12-02-87;Lov om endringar i plan- og bygningsloven (reglar om handtering av overvatn i byggjesaker mv.);Kongen bestemmer;;;2022-1501;lov;LOV-2008-06-27-71;Kommunal- og distriktsdepartementet;;;
25.11.2022   kl. 11.40;LOV-2022-11-25-86;Endringslov til folketrygdloven mv.;https://lovdata.no/dokument/LTI/lov/2022-11-25-86;Lov om endringer i folketrygdloven mv. (synliggjøring av folkerettslige forpliktelser til trygdekoordinering);Kongen bestemmer;;;2022-1478;lov;LOV-1948-12-03-7, LOV-1949-07-28-26, LOV-1957-06-28-12, LOV-1962-06-22-12, LOV-1983-06-03-54, LOV-1997-02-28-19, LOV-1998-06-26-41, LOV-1999-07-02-63, LOV-1999-07-02-61, LOV-2002-03-08-4, LOV-2006-06-16-20, LOV-2011-06-24-30, LOV-2013-06-21-102, LOV-2020-11-27-131;Arbeids- og inkluderingsdepartementet;EØS-avtalen vedlegg VIforordning (EF) nr. 883/2004forordning (EF) nr. 987/2009.;;
21.10.2022   kl. 11.45;LOV-2022-10-21-85;Endringslov til strømstønadsloven;https://lovdata.no/dokument/LTI/lov/2022-10-21-85;Lov om endringer i midlertidig lov om stønad til husholdninger som følge av ekstraordinære strømutgifter (økt stønadsgrad);21.10.2022;;;2022-1348;lov;LOV-2021-12-22-170;Olje- og energidepartementet;;;
22.06.2022   kl. 11.55;LOV-2022-06-22-84;Endringslov til vegtrafikkloven og yrkestransportloven;https://lovdata.no/dokument/LTI/lov/2022-06-22-84;Lov om endringer i vegtrafikkloven og yrkestransportloven (mobilitetspakken mv.);Kongen bestemmer;;;2022-0777;lov;LOV-1965-06-18-4, LOV-2002-06-21-45;Samferdselsdepartementet;EØS-avtalen vedlegg Xnr. 3 (forordning (EU) 2020/1055),EØS-avtalen vedlegg XIIInr. 19a (forordning (EU) 2020/1055),nr. 21b og 24e (forordning (EU) 2020/1054).;;
22.06.2022   kl. 11.55;LOV-2022-06-22-83;Endringslov til bildeprogramloven mv.;https://lovdata.no/dokument/LTI/lov/2022-06-22-83;Lov om endringer i bildeprogramloven mv. (oppheving av statlig forhåndskontroll av kinofilm);Kongen bestemmer;;;2022-0776;lov;LOV-2015-02-06-7, LOV-2005-05-20-28, LOV-2017-06-16-50;Kultur- og likestillingsdepartementet;;;
22.06.2022   kl. 11.55;LOV-2022-06-22-82;Endringslov til inndelingslova (ny fylkesinndeling);https://lovdata.no/dokument/LTI/lov/2022-06-22-82;Lov om endringer i inndelingslova (ny fylkesinndeling og nye fylkesnavn);01.01.2024;;;2022-0807;lov;LOV-2001-06-15-70;Kommunal- og distriktsdepartementet;;;
22.06.2022   kl. 11.55;LOV-2022-06-22-81;Endringslov til arveloven;https://lovdata.no/dokument/LTI/lov/2022-06-22-81;Lov om endringer i arveloven (digitalt skifte av dødsbo);22.06.2022;;;2022-0739;lov;LOV-2019-06-14-21;Kommunal- og distriktsdepartementet;;;
22.06.2022   kl. 11.55;LOV-2022-06-22-80;Endringslov til verdipapirhandelloven;https://lovdata.no/dokument/LTI/lov/2022-06-22-80;Lov om endringer i verdipapirhandelloven (flagging);Kongen bestemmer;;;2022-0771;lov;LOV-2007-06-29-75;Finansdepartementet;EØS-avtalen vedlegg IXdirektiv 2013/50/EU.;;
22.06.2022   kl. 11.55;LOV-2022-06-22-79;Endringslov til verdipapirhandelloven mv.;https://lovdata.no/dokument/LTI/lov/2022-06-22-79;Lov om endringer i verdipapirhandelloven mv. (samleproposisjon);Kongen bestemmer;;;2022-0772;lov;LOV-2007-06-29-75, LOV-2011-11-25-44, LOV-2014-06-20-28, LOV-2015-04-10-17, LOV-2018-06-01-23;Finansdepartementet;EØS-avtalen vedlegg IXdirektiv (EU) 2021/338,nr. 30 (direktiv (EU) 2019/1160),nr. 31bd (forordning (EU) 2019/1156).;;
22.06.2022   kl. 11.55;LOV-2022-06-22-78;Endringslov til tollavgiftsloven;https://lovdata.no/dokument/LTI/lov/2022-06-22-78;Lov om endring i tollavgiftsloven;22.06.2022;;;2022-0806;lov;LOV-2022-03-11-8;Finansdepartementet;;;
22.06.2022   kl. 11.55;LOV-2022-06-22-77;Endringslov til endring i merverdiavgiftsloven;https://lovdata.no/dokument/LTI/lov/2022-06-22-77;Lov om endring i lov 21. desember 2020 nr. 168 om endringer i merverdiavgiftsloven;22.06.2022;;;2022-0805;lov;LOV-2009-06-19-58, LOV-2020-12-21-168;Finansdepartementet;;;
22.06.2022   kl. 11.55;LOV-2022-06-22-76;Endringslov til folkeregisterloven;https://lovdata.no/dokument/LTI/lov/2022-06-22-76;Lov om endring i folkeregisterloven;22.06.2022;;;2022-0804;lov;LOV-2016-12-09-88;Finansdepartementet;;;
22.06.2022   kl. 11.55;LOV-2022-06-22-75;Endringslov til skatteforvaltningsloven;https://lovdata.no/dokument/LTI/lov/2022-06-22-75;Lov om endring i skatteforvaltningsloven;22.06.2022;;;2022-0803;lov;LOV-2016-05-27-14;Finansdepartementet;;;
22.06.2022   kl. 11.55;LOV-2022-06-22-74;Endringslov til skattebetalingsloven;https://lovdata.no/dokument/LTI/lov/2022-06-22-74;Lov om endring i skattebetalingsloven;22.06.2022, 01.01.2023;;;2022-0802;lov;LOV-2005-06-17-67;Finansdepartementet;;;
22.06.2022   kl. 11.55;LOV-2022-06-22-73;Endringslov til skatteloven;https://lovdata.no/dokument/LTI/lov/2022-06-22-73;Lov om endring i skatteloven;22.06.2022, 22.06.2022 med verknad frå og med inntektsåret 2022, 01.01.2023 med verknad for leveringa av skattemeldinga 2022;;;2022-0801;lov;LOV-1999-03-26-14;Finansdepartementet;;;
22.06.2022   kl. 11.55;LOV-2022-06-22-72;Endringslov til folketrygdloven;https://lovdata.no/dokument/LTI/lov/2022-06-22-72;Lov om endring i folketrygdloven;22.06.2022, 01.07.2022;;;2022-0800;lov;LOV-2021-12-17-146, LOV-1997-02-28-19;Finansdepartementet;;;
17.06.2022   kl. 12.35;LOV-2022-06-17-71;Endringslov til vegtrafikkloven;https://lovdata.no/dokument/LTI/lov/2022-06-17-71;Lov om endringer i vegtrafikkloven (krav til CO2-utslipp for tunge kjøretøy);Kongen bestemmer;;;2022-0778;lov;LOV-1965-06-18-4;Samferdselsdepartementet;EØS-avtalen vedlegg XXnr. 21azk (forordning (EU) 2018/956 endret ved forordning (EU) 2019/888)nr. 21azka (forordning (EU) 2019/1242).;;
17.06.2022   kl. 12.35;LOV-2022-06-17-70;Endringslov til yrkestransportloven;https://lovdata.no/dokument/LTI/lov/2022-06-17-70;Lov om endringer i yrkestransportloven (behandling av personopplysninger);17.06.2022;;;2022-0784;lov;LOV-2002-06-21-45;Samferdselsdepartementet;;;
17.06.2022   kl. 12.35;LOV-2022-06-17-69;Endringslov til hundeloven;https://lovdata.no/dokument/LTI/lov/2022-06-17-69;Lov om endringer i hundeloven (forsvarlig hundehold);Kongen bestemmer;;;2022-0746;lov;LOV-2003-07-04-74;Landbruks- og matdepartementet;;;
17.06.2022   kl. 12.35;LOV-2022-06-17-68;Endringslov til opplæringsloven, universitetsloven mv.;https://lovdata.no/dokument/LTI/lov/2022-06-17-68;Lov om endringer i opplæringsloven, universitets- og høyskoleloven og fagskoleloven (endring av NOKUTs oppgaver, studentrettigheter mv.);Kongen bestemmer;;;2022-0745;lov;LOV-1998-07-17-61, LOV-2005-04-01-15, LOV-2018-06-08-28;Kunnskapsdepartementet;;;
17.06.2022   kl. 12.35;LOV-2022-06-17-67;Endringslov til midl. lov om tilpasninger i barnehageloven mv. for å avhjelpe konsekvenser av utbrudd av covid-19;https://lovdata.no/dokument/LTI/lov/2022-06-17-67;Lov om endringer i midlertidig lov om tilpasninger i barnehageloven, opplæringslova og friskolelova for å avhjelpe konsekvenser av utbrudd av covid-19 (forlengelse);17.06.2022;;;2022-0775;lov;LOV-2020-05-26-52;Kunnskapsdepartementet;;;
17.06.2022   kl. 12.35;LOV-2022-06-17-66;Endringslov til vallova og partilova;https://lovdata.no/dokument/LTI/lov/2022-06-17-66;Lov om endringar i vallova og partilova (høve til elektroniske underskrifter på listeforslag, tidspunkt for førebels oppteljing av førehandsrøyster m.m.);17.06.2022;;;2022-0731;lov;LOV-2002-06-28-57, LOV-2005-06-17-102;Kommunal- og distriktsdepartementet;;;
17.06.2022   kl. 12.35;LOV-2022-06-17-65;Endringslov til forurensningsloven;https://lovdata.no/dokument/LTI/lov/2022-06-17-65;Lov om endringer i forurensningsloven (betingelsene for avfallsfasens opphør);17.06.2022;;;2022-0759;lov;LOV-1981-03-13-6;Klima- og miljødepartementet;EØS-avtalen vedlegg XXnr. 32ff (direktiv (EU) 2018/851).;;
17.06.2022   kl. 12.35;LOV-2022-06-17-64;Endringslov til naturmangfoldloven;https://lovdata.no/dokument/LTI/lov/2022-06-17-64;Lov om endringer i naturmangfoldloven (utnytting av genetisk materiale med opprinnelse i andre land og tradisjonell kunnskap knyttet til utnytting av slikt materiale);Kongen bestemmer;;;2022-0719;lov;LOV-2009-06-19-100;Klima- og miljødepartementet;;;
17.06.2022   kl. 12.35;LOV-2022-06-17-63;Endringslov til forvaltningsloven;https://lovdata.no/dokument/LTI/lov/2022-06-17-63;Lov om endringer i forvaltningsloven (skyldkrav ved administrativ foretakssanksjon og habilitetsreglenes anvendelse for statsråder);Kongen bestemmer;;;2022-0737;lov;LOV-1967-02-10;Justis- og beredskapsdepartementet;;;
17.06.2022   kl. 12.35;LOV-2022-06-17-62;Endringslov til straffegjennomføringsloven;https://lovdata.no/dokument/LTI/lov/2022-06-17-62;Lov om endringer i straffegjennomføringsloven (midlertidige regler om straffegjennomføring under utbrudd av en allmennfarlig smittsom sykdom);17.06.2022;;;2022-0786;lov;LOV-2021-12-17-149;Justis- og beredskapsdepartementet;;;
17.06.2022   kl. 12.35;LOV-2022-06-17-61;Endringslov til utlendingsloven;https://lovdata.no/dokument/LTI/lov/2022-06-17-61;Lov om endringer i utlendingsloven (tilsyn med omsorgen for enslige mindreårige som bor i asylmottak);Kongen bestemmer;;;2022-0779;lov;LOV-2008-05-15-35;Justis- og beredskapsdepartementet;;;
17.06.2022   kl. 12.35;LOV-2022-06-17-60;Midl. lov om tilpasninger i regelverket om internasjonalt samarbeid som følge av utbruddet av covid-19;https://lovdata.no/dokument/LTI/lov/2022-06-17-60;Midlertidig lov om tilpasninger i regelverket om internasjonalt rettslig samarbeid som følge av utbruddet av covid-19 (testing for covid-19 før uttransportering);Kongen bestemmer, 01.07.2023;;;2022-0785;lov;LOV-2021-12-17-148, LOV-2008-05-15-35;Justis- og beredskapsdepartementet;;;
17.06.2022   kl. 12.35;LOV-2022-06-17-59;Endringslov til naturskadeforsikringsloven mv.;https://lovdata.no/dokument/LTI/lov/2022-06-17-59;Lov om endringer i naturskadeforsikringsloven mv. (etablering av naturskadekapital i Norsk Naturskadepool mv.);Kongen bestemmer;;;2022-0747;lov;LOV-1972-05-12-28, LOV-1981-05-22-25, LOV-1989-06-16-69, LOV-1989-06-16-70, LOV-2020-12-18-146, LOV-2022-02-18-5;Justis- og beredskapsdepartementet;;;
17.06.2022   kl. 12.35;LOV-2022-06-17-58;Endringslov til straffeprosessloven og tvisteloven mv.;https://lovdata.no/dokument/LTI/lov/2022-06-17-58;Lov om endringer i straffeprosessloven og tvisteloven mv. (fjernmøter og fjernavhør i domstolene mv.);Kongen bestemmer, 01.01.2024;;;2022-0738;lov;LOV-1915-08-13-5, LOV-1981-05-22-25, LOV-2005-06-17-90, LOV-2013-06-21-100, LOV-2014-06-20-49;Justis- og beredskapsdepartementet;;;
17.06.2022   kl. 12.35;LOV-2022-06-17-57;Voldserstatningsloven;https://lovdata.no/dokument/LTI/lov/2022-06-17-57;Lov om erstatning fra staten til voldsutsatte (voldserstatningsloven);Kongen bestemmer;;;2022-0718;lov;LOV-1984-06-08-59, LOV-2001-04-20-13, LOV-1981-05-22-25, LOV-1980-06-13-35;Justis- og beredskapsdepartementet;;;
17.06.2022   kl. 12.35;LOV-2022-06-17-56;Digitalytelsesloven;https://lovdata.no/dokument/LTI/lov/2022-06-17-56;Lov om levering av digitale ytelser til forbrukere (digitalytelsesloven);Kongen bestemmer;;;2022-0724;lov;;Justis- og beredskapsdepartementet;EØS-avtalen vedlegg XIXnr. 7d (direktiv (EU) 2019/770).;;
17.06.2022   kl. 12.35;LOV-2022-06-17-55;Endringslov til lov om midlertidige endringer i smittevernloven;https://lovdata.no/dokument/LTI/lov/2022-06-17-55;Lov om midlertidige endringer i smittevernloven (forlengelse av reglene om koronasertifikat);17.06.2022, 01.07.2023;;;2022-0734;lov;LOV-1994-08-05-55;Helse- og omsorgsdepartementet;;;
17.06.2022   kl. 12.35;LOV-2022-06-17-54;Endringslov til legemiddelloven;https://lovdata.no/dokument/LTI/lov/2022-06-17-54;Lov om endringer i legemiddelloven (legemidler til dyr);Kongen bestemmer;;;2022-0736;lov;LOV-1992-12-04-132;Helse- og omsorgsdepartementet;EØS-avtalen vedlegg II kapittel XIIInr. 22 (forordning (EU) 2019/6).;;
17.06.2022   kl. 12.35;LOV-2022-06-17-53;Endringslov til lov om midlertidige endringer i smittevernloven mv.;https://lovdata.no/dokument/LTI/lov/2022-06-17-53;Lov om midlertidige endringer i smittevernloven og helseberedskapsloven (forlengelse av midlertidige forskriftshjemler for håndtering av koronapandemien);17.06.2022, 01.07.2023;;;2022-0735;lov;LOV-1994-08-05-55, LOV-2000-06-23-56, LOV-2021-05-28-44, LOV-2021-11-29-143;Helse- og omsorgsdepartementet;;;
17.06.2022   kl. 12.35;LOV-2022-06-17-52;Endringslov til tobakksskadeloven;https://lovdata.no/dokument/LTI/lov/2022-06-17-52;Lov om endringer i tobakksskadeloven (tekniske endringer i avgiftssystemet mv.);Kongen bestemmer;;;2022-0733;lov;LOV-1973-03-09-14;Helse- og omsorgsdepartementet;;;
17.06.2022   kl. 12.35;LOV-2022-06-17-51;Endringslov til pasientjournalloven;https://lovdata.no/dokument/LTI/lov/2022-06-17-51;Lov om endringer i pasientjournalloven mv. (nasjonal digital samhandling);Kongen bestemmer;;;2022-0780;lov;LOV-1997-02-28-19, LOV-2014-06-20-42;Helse- og omsorgsdepartementet;;;
17.06.2022   kl. 12.35;LOV-2022-06-17-50;Endringslov til forsvarsloven mv.;https://lovdata.no/dokument/LTI/lov/2022-06-17-50;Lov om endringer i forsvarsloven mv. (ny erstatningsordning for vernepliktige inne til førstegangstjeneste);Kongen bestemmer;;;2022-0741;lov;LOV-1989-06-16-65, LOV-2016-08-12-77;Forsvarsdepartementet;;;
17.06.2022   kl. 12.35;LOV-2022-06-17-49;Lov om informasjonstilgang for Riksrevisjonen;https://lovdata.no/dokument/LTI/lov/2022-06-17-49;Lov om informasjonstilgang for Riksrevisjonen ved undersøkelser av saker som gjelder stortingsrepresentantenes økonomiske ordninger;17.06.2022, 31.12.2022;;;2022-0732;lov;;Finansdepartementet;;;
17.06.2022   kl. 12.35;LOV-2022-06-17-48;Endringslov til skattebetalingsloven;https://lovdata.no/dokument/LTI/lov/2022-06-17-48;Lov om endringer i skattebetalingsloven;17.06.2022, med virkning fra og med inntektsåret 2022;;;2022-0774;lov;LOV-2005-06-17-67;Finansdepartementet;;;
17.06.2022   kl. 12.35;LOV-2022-06-17-47;Endringslov til petroleumsskatteloven;https://lovdata.no/dokument/LTI/lov/2022-06-17-47;Lov om endringer i petroleumsskatteloven;17.06.2022 med virkning fra og med inntektsåret 2022, straks med delvis virkning fra og med 01.01.2022;;;2022-0773;lov;LOV-1975-06-13-35;Finansdepartementet;;;
17.06.2022   kl. 12.35;LOV-2022-06-17-46;Endringslov til gravplassloven;https://lovdata.no/dokument/LTI/lov/2022-06-17-46;Lov om endringar i gravplassloven (teieplikt og arkiv m.m.);Kongen fastset;;;2022-0721;lov;LOV-1996-06-07-32;Barne- og familiedepartementet;;;
17.06.2022   kl. 12.35;LOV-2022-06-17-45;Endringslov til barnevernsloven mv.;https://lovdata.no/dokument/LTI/lov/2022-06-17-45;Lov om endringer i barnevernsloven mv. (krav om politiattest ved ansettelser i barne-, ungdoms- og familieetaten mv.);17.06.2022, Kongen bestemmer;;;2022-0722;lov;LOV-1992-07-17-100, LOV-2005-04-29-20, LOV-2021-06-18-97, LOV-2022-03-25-13;Barne- og familiedepartementet;;;
17.06.2022   kl. 12.35;LOV-2022-06-17-44;Lov om forskriftshjemmel, personopplysninger;https://lovdata.no/dokument/LTI/lov/2022-06-17-44;Lov om forskriftshjemmel for behandling av personopplysninger for frivillige tiltak på barne-, oppvekst- og familieområdet mv.;Kongen bestemmer;;;2022-0723;lov;LOV-1981-04-08-7, LOV-2012-06-22-43, LOV-2015-09-04-85, LOV-2017-06-16-48, LOV-2021-06-18-97;Barne- og familiedepartementet;;;
17.06.2022   kl. 12.35;LOV-2022-06-17-43;Endringslov til midl. lover om tilpasninger i introduksjonsloven mv. (covid-19, forlengelse);https://lovdata.no/dokument/LTI/lov/2022-06-17-43;Lov om endringer i midlertidige lover om tilpasninger i introduksjonsloven og integreringsloven for å avhjelpe konsekvenser av utbrudd av covid-19 (forlengelse);17.06.2022;;;2022-0782;lov;LOV-2020-05-26-53, LOV-2020-12-18-154;Arbeids- og inkluderingsdepartementet;;;
17.06.2022   kl. 12.35;LOV-2022-06-17-42;Endringslov til sosialtjenesteloven og arbeidsmiljøloven;https://lovdata.no/dokument/LTI/lov/2022-06-17-42;Lov om endringer i sosialtjenesteloven og arbeidsmiljøloven (statsforvalterens tilsynsvirksomhet, økonomisk stønad, forskriftshjemmel, m.m.);17.06.2022, 01.09.2022, 01.01.2023;;;2022-0781;lov;LOV-2005-06-17-62, LOV-2009-12-18-131, LOV-2021-06-11-78, LOV-2022-03-18-10;Arbeids- og inkluderingsdepartementet;;;
17.06.2022   kl. 12.35;LOV-2022-06-17-41;Endringslov til lover om unntak fra avkortingsreglene for alderspensjon;https://lovdata.no/dokument/LTI/lov/2022-06-17-41;Lov om endringer i lov om endring i lov om Statens pensjonskasse og enkelte andre lover (forlengelse av midlertidig unntak fra avkortingsreglene for alderspensjon som følge av covid-19);17.06.2022;;;2022-0783;lov;LOV-2020-03-20-3, LOV-1949-07-28-26, LOV-1953-06-26-11, LOV-1962-06-22-12, LOV-2020-03-20-4, LOV-2020-03-20-5;Arbeids- og inkluderingsdepartementet;;;
10.06.2022   kl. 11.50;LOV-2022-06-10-40;Endringslov til barnehageloven;https://lovdata.no/dokument/LTI/lov/2022-06-10-40;Lov om endringer i barnehageloven (selvstendig rettssubjekt, forbud mot annen virksomhet, meldeplikt m.m.);Kongen bestemmer;;;2022-0729;lov;LOV-2005-06-17-64;Kunnskapsdepartementet;;;
10.06.2022   kl. 11.50;LOV-2022-06-10-39;Endringslov til friskolelova;https://lovdata.no/dokument/LTI/lov/2022-06-10-39;Lov om endringer i friskolelova (nytt navn på loven og oppheving av to godkjenningsgrunnlag);Kongen bestemmer;;;2022-0730;lov;LOV-1992-07-17-100, LOV-1998-07-17-61, LOV-2003-07-04-84, LOV-2003-12-12-108, LOV-2005-06-17-64, LOV-2020-05-26-52, LOV-2021-06-11-78, LOV-2021-06-11-79, LOV-2021-06-18-97;Kunnskapsdepartementet;;;
10.06.2022   kl. 11.50;LOV-2022-06-10-38;Endringslov til sivilombudsloven;https://lovdata.no/dokument/LTI/lov/2022-06-10-38;Lov om endring i sivilombudsloven;10.06.2022;;;2022-0622;lov;LOV-2021-06-18-121;Justis- og beredskapsdepartementet;;;
10.06.2022   kl. 11.50;LOV-2022-06-10-37;Endringslov til helse- og omsorgstjenesteloven mv.;https://lovdata.no/dokument/LTI/lov/2022-06-10-37;Lov om endringer i helse- og omsorgstjenesteloven mv. (oppheving av lovregel om godkjenningsmodell for fritt brukervalg m.m.);10.06.2022;;;2022-0655;lov;LOV-2003-02-21-12, LOV-2011-06-24-30, LOV-2014-06-20-42, LOV-2014-06-20-43, LOV-1999-07-02-64, LOV-2001-06-15-93;Helse- og omsorgsdepartementet;;;
10.06.2022   kl. 11.50;LOV-2022-06-10-36;Forsvarssamarbeidsloven;https://lovdata.no/dokument/LTI/lov/2022-06-10-36;Lov om gjennomføring av tilleggsavtale mellom Norge og USA om forsvarssamarbeid av 16. april 2021 (forsvarssamarbeidsloven) mv.;Kongen bestemmer;;;2022-0742;lov;LOV-1981-05-22-25, LOV-2009-06-19-58;Forsvarsdepartementet;;;
10.06.2022   kl. 11.50;LOV-2022-06-10-35;Midlertidig endringslov som følge av ankomst av fordrevne fra Ukraina;https://lovdata.no/dokument/LTI/lov/2022-06-10-35;Lov om midlertidige endringer i lovverket som følge av ankomst av fordrevne fra Ukraina;Kongen bestemmer, 01.07.2023;;;2022-0740;lov;LOV-1992-07-17-100, LOV-1997-02-28-19, LOV-1998-07-17-61, LOV-1999-07-02-61, LOV-1999-07-02-63, LOV-2005-06-17-64, LOV-2008-06-27-71, LOV-2011-06-24-30, LOV-2020-11-06-127, LOV-2021-06-18-97;Arbeids- og inkluderingsdepartementet;;;
10.06.2022   kl. 11.50;LOV-2022-06-10-34;Endringslov til Norfundloven;https://lovdata.no/dokument/LTI/lov/2022-06-10-34;Lov om endringer i Norfundloven (forvalteroppgaver);10.06.2022;;;2022-0720;lov;LOV-1997-05-09-26;Utenriksdepartementet;;;
03.06.2022   kl. 11.45;LOV-2022-06-03-33;Endringslov til inkassoloven og finanstilsynsloven;https://lovdata.no/dokument/LTI/lov/2022-06-03-33;Lov om endringer i inkassoloven og finanstilsynsloven (klagebehandlingen av Finanstilsynets vedtak etter inkassoloven);Kongen bestemmer;;;2022-0376;lov;LOV-1956-12-07-1, LOV-1988-05-13-26;Justis- og beredskapsdepartementet;;;
03.06.2022   kl. 11.45;LOV-2022-06-03-32;Endringslov til lov om endringer i helselovgivningen;https://lovdata.no/dokument/LTI/lov/2022-06-03-32;Lov om endringer i lov om endringer i helselovgivningen (oppheving av overføring av det offentlige tannhelsetjenesteansvaret);03.06.2022;;;2022-0656;lov;LOV-2017-06-16-55;Helse- og omsorgsdepartementet;;;
23.05.2022   kl. 12.25;LOV-2022-05-23-31;Endringslov til finansforetaksloven og verdipapirfondloven;https://lovdata.no/dokument/LTI/lov/2022-05-23-31;Lov om endringer i finansforetaksloven og verdipapirfondloven (obligasjoner med fortrinnsrett);Kongen bestemmer;;;2022-0379;lov;LOV-2011-11-25-44, LOV-2015-04-10-17;Finansdepartementet;EØS-avtalen vedlegg IXdirektiv (EU) 2019/2162forordning (EU) 2019/2160.;;
20.05.2022   kl. 11.45;LOV-2022-05-20-30;Endringslov til genteknologiloven;https://lovdata.no/dokument/LTI/lov/2022-05-20-30;Lov om endringer i genteknologiloven (offentlighet);Kongen bestemmer;;;2022-0599;lov;LOV-1993-04-02-38;Helse- og omsorgsdepartementet;EØS-avtalens vedlegg I, vedlegg II, vedlegg XXforordning (EU) 2019/1381.;;
20.05.2022   kl. 11.45;LOV-2022-05-20-29;Endringslov til helsepersonelloven, pasient- og brukerrettighetsloven mv.;https://lovdata.no/dokument/LTI/lov/2022-05-20-29;Lov om endringer i helsepersonelloven, pasient- og brukerrettighetsloven mv. (administrative reaksjoner, tilsynsmyndighetenes saksbehandling av henvendelser om pliktbrudd m.m.);Kongen bestemmer;;;2022-0600;lov;LOV-1983-06-03-54, LOV-1999-07-02-61, LOV-1999-07-02-63, LOV-1999-07-02-64, LOV-2011-06-24-30, LOV-2017-12-15-107;Helse- og omsorgsdepartementet;;;
12.05.2022   kl. 11.10;LOV-2022-05-12-28;Advokatloven;https://lovdata.no/dokument/LTI/lov/2022-05-12-28;Lov om advokater og andre som yter rettslig bistand (advokatloven);Ikrafttredelse fastsettes ved lov;;;2022-0553;lov;LOV-1915-08-13-5, LOV-1981-05-22-25, LOV-1984-06-08-58, LOV-1988-05-13-26, LOV-2005-05-20-28, LOV-2005-06-17-85, LOV-2005-06-17-90, LOV-2007-06-29-73, LOV-2010-03-26-9;Justis- og beredskapsdepartementet;;16.05.2022 (se nederst).;
06.05.2022   kl. 11.40;LOV-2022-05-06-27;Endringslov til rettshjelploven og husleieloven;https://lovdata.no/dokument/LTI/lov/2022-05-06-27;Lov om endringer i rettshjelploven og husleieloven (Husleietvistutvalgets geografiske virkeområde, faglige uavhengighet, innhenting av taushetsbelagt informasjon fra Folkeregisteret mv.);Kongen bestemmer;;;2022-0471;lov;LOV-1980-06-13-35, LOV-1999-03-26-17;Kommunal- og distriktsdepartementet;;;
29.04.2022   kl. 11.50;LOV-2022-04-29-26;Endringslov til grenseloven, utlendingsloven og politiregisterloven;https://lovdata.no/dokument/LTI/lov/2022-04-29-26;Lov om endringer i grenseloven, utlendingsloven og politiregisterloven (etablering av systemer for inn- og utreise, fremreise og passasjerlisteopplysninger mv.);Kongen bestemmer, 29.04.2022;;;2022-0357;lov;LOV-2008-05-15-35, LOV-2010-05-28-16, LOV-2018-04-20-8;Justis- og beredskapsdepartementet;forordning (EU) 2017/2226,forordning (EU) 2017/2225,forordning (EU) 2018/1240;;
29.04.2022   kl. 11.50;LOV-2022-04-29-25;Endringslov til midlertidig strømstønadslov;https://lovdata.no/dokument/LTI/lov/2022-04-29-25;Lov om endringer i midlertidig lov om stønad til husholdninger som følge av ekstraordinære strømutgifter (forlenget strømstønad);29.04.2022;;;2022-0473;lov;LOV-2021-12-22-170;Finansdepartementet;;;
29.04.2022   kl. 11.50;LOV-2022-04-29-24;Endringslov til tolloven;https://lovdata.no/dokument/LTI/lov/2022-04-29-24;Lov om endringer i tolloven (forskriftshjemmel om at loven skal gjelde for Svalbard);29.04.2022;;;2022-0472;lov;LOV-2007-12-21-119;Finansdepartementet;;;
08.04.2022   kl. 11.50;LOV-2022-04-08-23;Endringslov til statsansatteloven m.m.;https://lovdata.no/dokument/LTI/lov/2022-04-08-23;Lov om endringar i statsansatteloven m.m. (lovheimel for registrering av verva og dei økonomiske interessene til enkelte statstilsette);Kongen fastset;;;2022-0294;lov;LOV-1991-08-30-71, LOV-2017-06-16-67;Kommunal- og distriktsdepartementet;;;
08.04.2022   kl. 11.50;LOV-2022-04-08-22;Endringslov til straffeloven mv.;https://lovdata.no/dokument/LTI/lov/2022-04-08-22;Lov om endringer i straffeloven mv. (klargjøring av inndragningsregler m.m.);Kongen bestemmer;;;2022-0377;lov;LOV-1969-06-13-26, LOV-2005-05-20-28;Justis- og beredskapsdepartementet;;;
08.04.2022   kl. 11.50;LOV-2022-04-08-21;Endringslov til utlendingsloven;https://lovdata.no/dokument/LTI/lov/2022-04-08-21;Lov om endringer i utlendingsloven (om tilgang til å sammenligne opplysninger i Eurodac sentralregister for rettshåndhevelsesformål);Kongen bestemmer;;;2022-0378;lov;LOV-2008-05-15-35;Justis- og beredskapsdepartementet;Schengen-avtalenforordning (EU) nr. 603/2013.;;
08.04.2022   kl. 11.50;LOV-2022-04-08-20;Endringslov til finansforetaksloven mv.;https://lovdata.no/dokument/LTI/lov/2022-04-08-20;Lov om endringer i finansforetaksloven mv. (gjennomføring av EØS-rett, egen pensjonskonto);Kongen bestemmer;;;2022-0380;lov;LOV-2005-06-10-44, LOV-2015-04-10-17, LOV-2000-11-24-81;Finansdepartementet;EØS-avtalen vedlegg IXdirektiv (EU) 2016/2341.;;
08.04.2022   kl. 11.50;LOV-2022-04-08-19;Endringslov til arbeidsmiljøloven;https://lovdata.no/dokument/LTI/lov/2022-04-08-19;Lov om endringer i arbeidsmiljøloven (søksmålsrett for fagforeninger om ulovlig innleie);Kongen bestemmer;;;2022-0428;lov;LOV-2005-06-17-62;Arbeids- og inkluderingsdepartementet;;;
01.04.2022   kl. 11.45;LOV-2022-04-01-18;Endringslov til helsepersonelloven og pasient- og brukerrettighetsloven;https://lovdata.no/dokument/LTI/lov/2022-04-01-18;Lov om endringer i helsepersonelloven og pasient- og brukerrettighetsloven (regulering av kosmetiske inngrep, injeksjoner og behandling);Kongen bestemmer;;;2022-0325;lov;LOV-1999-07-02-63, LOV-1999-07-02-64;Helse- og omsorgsdepartementet;;;
01.04.2022   kl. 11.45;LOV-2022-04-01-17;Endringslov til folketrygdloven, lov om Statens pensjonskasse mv;https://lovdata.no/dokument/LTI/lov/2022-04-01-17;Lov om endringer i folketrygdloven, lov om Statens pensjonskasse og enkelte andre lover (endret regulering av alderspensjon under utbetaling);Kongen bestemmer;;;2022-0356;lov;LOV-1948-12-03-7, LOV-1949-07-28-26, LOV-1951-06-29-34, LOV-1957-06-28-12, LOV-1958-12-12-10, LOV-1962-06-22-12, LOV-1997-02-28-19, LOV-1999-01-15-1, LOV-2010-06-25-28, LOV-2011-12-16-60, LOV-2013-12-13-106;Arbeids- og inkluderingsdepartementet;;;
25.03.2022   kl. 12.00;LOV-2022-03-25-16;Endringslov til utlendingsloven;https://lovdata.no/dokument/LTI/lov/2022-03-25-16;Lov om endringer i utlendingsloven (innhenting av opplysninger fra utdanningsinstitusjoner mv.);Kongen bestemmer;;;2022-0327;lov;LOV-2008-05-15-35;Justis- og beredskapsdepartementet;;;
25.03.2022   kl. 12.00;LOV-2022-03-25-15;Endringslov til utlendingsloven;https://lovdata.no/dokument/LTI/lov/2022-03-25-15;Lov om endringer i utlendingsloven (partsbegrepet mv. i utlendingssaker);Kongen bestemmer;;;2022-0328;lov;LOV-2008-05-15-35;Justis- og beredskapsdepartementet;;;
25.03.2022   kl. 12.00;LOV-2022-03-25-14;Endringslov til helsepersonelloven;https://lovdata.no/dokument/LTI/lov/2022-03-25-14;Lov om endringer i helsepersonelloven (autorisasjon av naprapater, osteopater og paramedisinere);Kongen bestemmer;;;2022-0326;lov;LOV-1999-07-02-64;Helse- og omsorgsdepartementet;;;
25.03.2022   kl. 12.00;LOV-2022-03-25-13;Endringslov til barnevernloven mv.;https://lovdata.no/dokument/LTI/lov/2022-03-25-13;Lov om endringer i barnevernloven mv. (tverrfaglig helsekartlegging);Kongen bestemmer;;;2022-0290;lov;LOV-1992-07-17-100, LOV-2010-02-12-4, LOV-2021-06-18-97;Barne- og familiedepartementet;;;
18.03.2022   kl. 11.45;LOV-2022-03-18-12;Pengespilloven;https://lovdata.no/dokument/LTI/lov/2022-03-18-12;Lov om pengespill (pengespilloven);Kongen bestemmer;;;2022-0288;lov;LOV-1924-06-13-4, LOV-1927-07-01-3, LOV-1992-08-28-103, LOV-1992-12-04-127, LOV-1995-02-24-11, LOV-1999-03-26-14, LOV-2003-05-23-35, LOV-2009-06-19-58, LOV-2018-06-01-23;Kultur- og likestillingsdepartementet;;;
18.03.2022   kl. 11.45;LOV-2022-03-18-11;Endringslov til folketrygdloven mv.;https://lovdata.no/dokument/LTI/lov/2022-03-18-11;Lov om endringer i folketrygdloven mv. (styrking av fedres rett til foreldrepenger mv.);Kongen bestemmer;;;2022-0289;lov;LOV-1997-02-28-19, LOV-1998-06-26-41;Barne- og familiedepartementet;Direktiv (EU) 2019/1158;;
18.03.2022   kl. 11.45;LOV-2022-03-18-10;Endringslov til arbeidsmiljøloven;https://lovdata.no/dokument/LTI/lov/2022-03-18-10;Lov om endringer i arbeidsmiljøloven (midlertidig ansettelse);Kongen bestemmer;;;2022-0291;lov;LOV-2005-06-17-62;Arbeids- og inkluderingsdepartementet;;;
11.03.2022   kl. 14.25;LOV-2022-03-11-9;Vareførselsloven;https://lovdata.no/dokument/LTI/lov/2022-03-11-9;Lov om inn- og utførsel av varer (vareførselsloven);Kongen bestemmer;;;2022-0292;lov;LOV-1981-05-22-25, LOV-1997-06-13-42, LOV-2003-06-27-57, LOV-2005-06-17-67, LOV-2005-06-17-90, LOV-2007-12-21-119, LOV-2008-05-15-35;Finansdepartementet;;;
11.03.2022   kl. 14.25;LOV-2022-03-11-8;Tollavgiftsloven;https://lovdata.no/dokument/LTI/lov/2022-03-11-8;Lov om tollavgift (tollavgiftsloven);Kongen bestemmer;;;2022-0293;lov;LOV-1893-07-20-2, LOV-1972-06-09-31, LOV-1973-03-09-14, LOV-1997-06-06-32, LOV-2005-06-17-67, LOV-2009-06-19-58, LOV-2016-05-27-14, LOV-2018-06-01-23;Finansdepartementet;;;
04.03.2022   kl. 11.40;LOV-2022-03-04-7;Støtteprosessloven;https://lovdata.no/dokument/LTI/lov/2022-03-04-7;Lov om nasjonale saksbehandlingsregler i saker om offentlig støtte (støtteprosessloven);Kongen bestemmer;;;2022-0214;lov;LOV-1992-11-27-117, LOV-2007-12-21-119, LOV-2016-05-27-14, LOV-2020-04-17-29;Nærings- og fiskeridepartementet;EØS-avtalen artikkel 59 og 61,EØS-avtalen vedlegg XV;;
18.02.2022   kl. 11.45;LOV-2022-02-18-6;Endringslov til SIS-loven mv.;https://lovdata.no/dokument/LTI/lov/2022-02-18-6;Lov om endringer i lov om Schengen informasjonssystem (SIS-loven) mv.;Kongen bestemmer;;;2022-0212;lov;LOV-1999-07-16-66, LOV-2008-05-15-35, LOV-2010-05-28-16;Justis- og beredskapsdepartementet;Forordning (EU) 2018/1860, forordning (EU) 2018/1861, forordning (EU) 2018/1862.;;
18.02.2022   kl. 11.45;LOV-2022-02-18-5;Endringslov til forsikringsavtaleloven mv.;https://lovdata.no/dokument/LTI/lov/2022-02-18-5;Lov om endringer i forsikringsavtaleloven mv. (forsikringsdistribusjon mv.);Kongen bestemmer;;;2022-0213;lov;LOV-1961-02-03, LOV-1988-12-23-104, LOV-1989-06-16-69, LOV-2014-06-20-27, LOV-2020-12-18-146;Justis- og beredskapsdepartementet;EØS-avtalen vedlegg IXdirektiv (EU) 2016/97EØS-komiteens beslutning nr. 214/2018.;;
28.01.2022   kl. 11.45;LOV-2022-01-28-4;Endringslov til strømstønadsloven;https://lovdata.no/dokument/LTI/lov/2022-01-28-4;Lov om endringer i midlertidig lov om stønad til husholdninger som følge av ekstraordinære strømutgifter;28.01.2022;;;2022-0108;lov;LOV-2021-12-22-170;Olje- og energidepartementet;;;
28.01.2022   kl. 11.45;LOV-2022-01-28-3;Endringslov til lov om midlertidig tilskuddsordning for foretak med stort omsetningsfall etter august 2020;https://lovdata.no/dokument/LTI/lov/2022-01-28-3;Lov om endringer i lov om midlertidig tilskuddsordning for foretak med stort omsetningsfall etter august 2020 (økonomiske tiltak i møte med pandemien: midlertidig tilskuddsordning for foretak med stort omsetningsfall);28.01.2022;;;2022-0106;lov;LOV-2020-12-18-156;Nærings- og fiskeridepartementet;;;
28.01.2022   kl. 11.45;LOV-2022-01-28-2;Lov om lønnsstøtte (økonomiske tiltak i møte med pandemien);https://lovdata.no/dokument/LTI/lov/2022-01-28-2;Lov om lønnsstøtte (økonomiske tiltak i møte med pandemien);Kongen bestemmer;;;2022-0105;lov;;Finansdepartementet;;;
28.01.2022   kl. 11.45;LOV-2022-01-28-1;Endringslov til midlertidig lov om kompensasjonsytelse for selvstendig næringsdrivende og frilansere som har mistet inntekt som følge av utbrudd av covid-19;https://lovdata.no/dokument/LTI/lov/2022-01-28-1;Lov om endringer i midlertidig lov om kompensasjonsytelse for selvstendig næringsdrivende og frilansere som har mistet inntekt som følge av utbrudd av covid-19;28.01.2022, med virkning fra 01.01.2022;;;2022-0107;lov;LOV-2021-11-12-141;Arbeids- og inkluderingsdepartementet;;;
22.12.2021   kl. 11.05;LOV-2021-12-22-171;Endringslov til midlertidig lov om billettering på ferje (covid-19);https://lovdata.no/dokument/LTI/lov/2021-12-22-171;Lov om endringar i midlertidig lov om billettering på ferje som følge av utbrudd av covid-19;22.12.2021;;;2021-2265;lov;LOV-2020-05-26-55;Samferdselsdepartementet;;;
22.12.2021   kl. 11.05;LOV-2021-12-22-170;Strømstønadsloven;https://lovdata.no/dokument/LTI/lov/2021-12-22-170;Midlertidig lov om stønad til husholdninger som følge av ekstraordinære strømutgifter (strømstønadsloven);Kongen bestemmer, oppheves 01.07.2022;;;2021-2268;lov;;Olje- og energidepartementet;;;
22.12.2021   kl. 11.05;LOV-2021-12-22-169;Endringslov til mineralloven (retting av inkurier);https://lovdata.no/dokument/LTI/lov/2021-12-22-169;Lov om endringer i mineralloven (retting av inkurier);22.12.2021;;;2021-2148;lov;LOV-2009-06-19-101;Nærings- og fiskeridepartementet;;;
22.12.2021   kl. 11.05;LOV-2021-12-22-168;Endringslov til lov om film og videogram;https://lovdata.no/dokument/LTI/lov/2021-12-22-168;Lov om endringer i lov om film og videogram (oppheving av registrerings- og gebyrplikt mv.);01.01.2022;;;2021-2235;lov;LOV-1987-05-15-21;Kulturdepartementet;;;
22.12.2021   kl. 11.05;LOV-2021-12-22-167;Endringslov til rekonstruksjonsloven;https://lovdata.no/dokument/LTI/lov/2021-12-22-167;Lov om endring i rekonstruksjonsloven (forlengelse av lovens virketid);22.12.2021;;;2021-2238;lov;LOV-2020-05-07-38;Justis- og beredskapsdepartementet;;;
22.12.2021   kl. 11.05;LOV-2021-12-22-166;Endringslov til rettsgebyrloven;https://lovdata.no/dokument/LTI/lov/2021-12-22-166;Lov om endringer i rettsgebyrloven (nedjustering av gebyrer);01.01.2022;;;2021-2237;lov;LOV-1982-12-17-86;Justis- og beredskapsdepartementet;;;
22.12.2021   kl. 11.05;LOV-2021-12-22-165;Endringslov til pasientjournalloven;https://lovdata.no/dokument/LTI/lov/2021-12-22-165;Lov om endringer i pasientjournalloven (tilgjengeliggjøring av og betaling for nasjonale e-helseløsninger m.m.);Kongen bestemmer;;;2021-2236;lov;LOV-2014-06-20-42;Helse- og omsorgsdepartementet;;;
22.12.2021   kl. 11.05;LOV-2021-12-22-164;Endringslov til pensjonslovgivningen mv.;https://lovdata.no/dokument/LTI/lov/2021-12-22-164;Lov om endringer i pensjonslovgivningen mv. (pensjon fra første krone og dag, garanterte pensjonsprodukter);Kongen bestemmer;;;2021-2264;lov;LOV-2000-03-24-16, LOV-2000-11-24-81, LOV-2005-06-10-44, LOV-2005-12-21-124, LOV-2013-12-13-106;Finansdepartementet;;;
22.12.2021   kl. 11.05;LOV-2021-12-22-163;Forsikringsformidlingsloven;https://lovdata.no/dokument/LTI/lov/2021-12-22-163;Lov om forsikringsformidling (forsikringsformidlingsloven);Kongen bestemmer;;;2021-2233;lov;LOV-2005-06-10-44, LOV-2005-06-10-41, LOV-2015-04-10-17;Finansdepartementet;EØS-avtalens vedlegg IXnr. 13e (direktiv (EU) 2016/97, endret ved direktiv (EU) 2018/411);;
22.12.2021   kl. 11.05;LOV-2021-12-22-162;Endringslov til verdipapirhandelloven;https://lovdata.no/dokument/LTI/lov/2021-12-22-162;Lov om endringer i verdipapirhandelloven (EU-gjenopprettingsprospekt mv.);Kongen bestemmer;;;2021-2234;lov;LOV-2007-06-29-75;Finansdepartementet;EØS-avtalen vedlegg IXnr. 29bd (forordning (EU) 2021/337);;
22.12.2021   kl. 11.05;LOV-2021-12-22-161;Lov om offentliggjøring av bærekraftsinformasjon i finanssektoren mv.;https://lovdata.no/dokument/LTI/lov/2021-12-22-161;Lov om offentliggjøring av bærekraftsinformasjon i finanssektoren og et rammeverk for bærekraftige investeringer;Kongen bestemmer;;;2021-2232;lov;LOV-1998-07-17-56;Finansdepartementet;EØS-avtalen vedlegg IXforordning (EU) 2019/2088,forordning (EU) 2020/852;;
22.12.2021   kl. 11.05;LOV-2021-12-22-160;Endringslov til endring i merverdiavgiftsloven;https://lovdata.no/dokument/LTI/lov/2021-12-22-160;Lov om endring i lov 21. desember 2020 nr. 168 om endringer i merverdiavgiftsloven;22.12.2021;;;2021-2231;lov;LOV-2009-06-19-58, LOV-2020-12-21-168;Finansdepartementet;;;
22.12.2021   kl. 11.05;LOV-2021-12-22-159;Endringslov til folkeregisterloven;https://lovdata.no/dokument/LTI/lov/2021-12-22-159;Lov om endringer i folkeregisterloven;Kongen bestemmer;;;2021-2230;lov;LOV-2016-12-09-88;Finansdepartementet;;;
22.12.2021   kl. 11.05;LOV-2021-12-22-158;Endringslov til skatteforvaltningsloven;https://lovdata.no/dokument/LTI/lov/2021-12-22-158;Lov om endringer i skatteforvaltningsloven;01.01.2022, Kongen bestemmer;;;2021-2229;lov;LOV-2016-05-27-14;Finansdepartementet;;;
22.12.2021   kl. 11.05;LOV-2021-12-22-157;Endringslov til SI-loven;https://lovdata.no/dokument/LTI/lov/2021-12-22-157;Lov om endringer i SI-loven;Kongen bestemmer;;;2021-2228;lov;LOV-2013-01-11-3;Finansdepartementet;;;
22.12.2021   kl. 11.05;LOV-2021-12-22-156;Endringslov til a-opplysningsloven;https://lovdata.no/dokument/LTI/lov/2021-12-22-156;Lov om endring i a-opplysningsloven;01.01.2022;;;2021-2227;lov;LOV-2012-06-22-43;Finansdepartementet;;;
22.12.2021   kl. 11.05;LOV-2021-12-22-155;Endringslov til tolloven;https://lovdata.no/dokument/LTI/lov/2021-12-22-155;Lov om endringer i tolloven;22.12.2021;;;2021-2226;lov;LOV-2007-12-21-119;Finansdepartementet;;;
22.12.2021   kl. 11.05;LOV-2021-12-22-154;Endringslov til skattebetalingsloven;https://lovdata.no/dokument/LTI/lov/2021-12-22-154;Lov om endringer i skattebetalingsloven;Kongen bestemmer;;;2021-2225;lov;LOV-2005-06-17-67;Finansdepartementet;;;
22.12.2021   kl. 11.05;LOV-2021-12-22-153;Endringslov til bidragsinnkrevingsloven;https://lovdata.no/dokument/LTI/lov/2021-12-22-153;Lov om endring i bidragsinnkrevingsloven;Kongen bestemmer;;;2021-2224;lov;LOV-2005-04-29-20;Finansdepartementet;;;
22.12.2021   kl. 11.05;LOV-2021-12-22-152;Endringslov til skatteloven;https://lovdata.no/dokument/LTI/lov/2021-12-22-152;Lov om endringer i skatteloven;22.12.2021, 12.10.2021, inntektsåret 2021, inntektsåret 2022;;;2021-2223;lov;LOV-1999-03-26-14;Finansdepartementet;;;
22.12.2021   kl. 11.05;LOV-2021-12-22-151;Endringslov til folketrygdloven;https://lovdata.no/dokument/LTI/lov/2021-12-22-151;Lov om endringer i folketrygdloven;22.12.2021, 01.01.2022, inntektsåret 2021, inntektsåret 2022;;;2021-2222;lov;LOV-1997-02-28-19;Finansdepartementet;;;
22.12.2021   kl. 11.05;LOV-2021-12-22-150;Midl. lov om tilpasninger i regelverket for barnevernet mv.;https://lovdata.no/dokument/LTI/lov/2021-12-22-150;Midlertidig lov om tilpasninger i regelverket for barnevernet og fylkesnemnda for å avhjelpe konsekvenser av utbruddet av covid-19;Kongen bestemmer, oppheves 01.07.2022;;;2021-2266;lov;;Barne- og familiedepartementet;;;
17.12.2021   kl. 12.50;LOV-2021-12-17-149;Endringslov til straffegjennomføringsloven;https://lovdata.no/dokument/LTI/lov/2021-12-17-149;Lov om endringer i straffegjennomføringsloven (midlertidige regler om straffegjennomføring under utbrudd av en allmennfarlig smittsom sykdom);17.12.2021, oppheves 01.07.2022;;;2021-2045;lov;LOV-2001-05-18-21;Justis- og beredskapsdepartementet;;;
17.12.2021   kl. 12.50;LOV-2021-12-17-148;Midlertidig lov om tilpasninger i prosessregelverket (covid-19);https://lovdata.no/dokument/LTI/lov/2021-12-17-148;Midlertidig lov om enkelte tilpasninger i prosessregelverket som følge av utbruddet av covid-19;17.12.2021, oppheves 01.07.2022;;;2021-2044;lov;;Justis- og beredskapsdepartementet;;;
17.12.2021   kl. 12.50;LOV-2021-12-17-147;Endringslov til permitteringslønnsloven;https://lovdata.no/dokument/LTI/lov/2021-12-17-147;Lov om endring i lov om lønnsplikt under permittering (økning av arbeidsgiverperioden);Kongen bestemmer;;;2021-2146;lov;LOV-1988-05-06-22;Arbeids- og sosialdepartementet;;;
17.12.2021   kl. 12.50;LOV-2021-12-17-146;Endringslov til folketrygdloven og enkelte andre lover;https://lovdata.no/dokument/LTI/lov/2021-12-17-146;Lov om endringer i folketrygdloven og enkelte andre lover (samleproposisjon høsten 2021);17.12.2021, 01.01.2022, 01.07.2022;;;2021-2145;lov;LOV-1949-07-28-26, LOV-1997-02-28-19, LOV-1957-07-06-26, LOV-1953-06-26-11, LOV-1962-06-22-12;Arbeids- og sosialdepartementet;;;
17.12.2021   kl. 12.50;LOV-2021-12-17-145;Endringslov til pensjonslover (covid-19);https://lovdata.no/dokument/LTI/lov/2021-12-17-145;Lov om endringer i lov om endring i lov om Statens pensjonskasse og enkelte andre lover (forlengelse av midlertidig unntak fra avkortingsreglene for alderspensjon som følge av covid-19);17.12.2021;;;2021-2147;lov;LOV-1949-07-28-26, LOV-1953-06-26-11, LOV-1962-06-22-12, LOV-2020-03-20-3, LOV-2020-03-20-4, LOV-2020-03-20-5;Arbeids- og sosialdepartementet;;;
30.11.2021   kl. 12.40;LOV-2021-11-30-144;Endringslov til midlertidige lover, covid-19, forlengelse;https://lovdata.no/dokument/LTI/lov/2021-11-30-144;Lov om endringer i midlertidige lover om tilpasninger i barnehageloven, opplæringsloven, friskoleloven, introduksjonsloven og integreringsloven for å avhjelpe konsekvenser av utbrudd av covid-19 (forlengelse);30.11.2021;;;2021-1895;lov;LOV-2020-05-26-52, LOV-2020-05-26-53, LOV-2020-12-18-154;Kunnskapsdepartementet;;;
29.11.2021   kl. 10.15;LOV-2021-11-29-143;Endringslov til smittevernloven og helseberedskapsloven;https://lovdata.no/dokument/LTI/lov/2021-11-29-143;Lov om endringer i smittevernloven og helseberedskapsloven (forlengelse av midlertidige forskriftshjemler for håndtering av koronapandemien mv.);29.11.2021, oppheves 01.07.2022;;;2021-1894;lov;LOV-1994-08-05-55, LOV-2021-05-28-44, LOV-2021-06-11-65, LOV-2021-06-11-66, LOV-2021-06-18-125;Helse- og omsorgsdepartementet;;;
26.11.2021   kl. 11.45;LOV-2021-11-26-142;Endringslov til midlertidig lov om innreiserestriksjoner mv.;https://lovdata.no/dokument/LTI/lov/2021-11-26-142;Lov om endringer i midlertidig lov om innreiserestriksjoner for utlendinger av hensyn til folkehelsen (forlengelse);26.11.2021;;;2021-1896;lov;LOV-2020-06-19-83;Justis- og beredskapsdepartementet;;;
12.11.2021   kl. 11.40;LOV-2021-11-12-141;Midl. lov om kompensasjonsytelse for næringsdrivende og frilansere, covid-19;https://lovdata.no/dokument/LTI/lov/2021-11-12-141;Midlertidig lov om kompensasjonsytelse for selvstendig næringsdrivende og frilansere som har mistet inntekt som følge av utbrudd av covid-19;12.11.2021, med virkning fra 01.10.2021, oppheves 01.02.2022;;;2021-1844;lov;;Arbeids- og sosialdepartementet;;;
18.06.2021   kl. 12.50;LOV-2021-06-18-140;Opphevelse av lov om tilbud av grunnleggende banktjenester gjennom Posten;https://lovdata.no/dokument/LTI/lov/2021-06-18-140;Lov om opphevelse av lov 21. juni 2002 nr. 44 om tilbud av grunnleggende banktjenester gjennom Posten Norge AS' ekspedisjonsnett;Kongen bestemmer;;;2021-1046;lov;LOV-2002-06-21-44;Samferdselsdepartementet;;;
18.06.2021   kl. 12.50;LOV-2021-06-18-139;Lov om utleie av små elektriske kjøretøy på offentlig grunn;https://lovdata.no/dokument/LTI/lov/2021-06-18-139;Lov om utleie av små elektriske kjøretøy på offentlig grunn;18.06.2021;;;2021-1044;lov;;Samferdselsdepartementet;;;
18.06.2021   kl. 12.50;LOV-2021-06-18-138;Endringslov til energiloven;https://lovdata.no/dokument/LTI/lov/2021-06-18-138;Lov om endringer i energiloven (fire forordninger om kraftmarkedet);Kongen bestemmer;;;2021-1062;lov;LOV-1990-06-29-50;Olje- og energidepartementet;EØS-avtalen vedlegg IVnr. 49 (forordning (EU) 2015/1222),nr. 50 (forordning (EU) 2016/1719),nr. 51 (forordning (EU) 2017/1485),nr. 52 (forordning (EU) 2017/2195).;;
18.06.2021   kl. 12.50;LOV-2021-06-18-137;Endringslov til føretakslovgjevinga;https://lovdata.no/dokument/LTI/lov/2021-06-18-137;Lov om endringar i føretakslovgjevinga (retting av feil m.m.);Kongen fastset;;;2021-1064;lov;LOV-1985-06-21-78, LOV-2003-12-19-130, LOV-1997-06-13-44, LOV-1985-06-21-80, LOV-1997-06-13-45;Nærings- og fiskeridepartementet;EØS-avtalen vedlegg XXIInr. 10g (direktiv (EU) 2017/828).;;
18.06.2021   kl. 12.50;LOV-2021-06-18-136;Lov om røystingsrådgjevarar;https://lovdata.no/dokument/LTI/lov/2021-06-18-136;Lov om røystingsrådgjevarar;Kongen fastset;;;2021-1063;lov;;Nærings- og fiskeridepartementet;EØS-avtalen vedlegg XXIInr. 10g (direktiv (EU) 2017/828).;;
18.06.2021   kl. 12.50;LOV-2021-06-18-135;Endringslov til lov om forbud mot hold av pelsdyr (kompensasjonsordning);https://lovdata.no/dokument/LTI/lov/2021-06-18-135;Lov om endringer i lov om forbud mot hold av pelsdyr (kompensasjonsordning);Kongen bestemmer;;;2021-0953;lov;LOV-2019-06-21-63;Landbruks- og matdepartementet;;;
18.06.2021   kl. 12.50;LOV-2021-06-18-134;Endringslov til dyrevelferdsloven (bestemmelser om avl, dekning av kostnader og behandling av personopplysninger);https://lovdata.no/dokument/LTI/lov/2021-06-18-134;Lov om endringer i lov om dyrevelferd (bestemmelser om avl, dekning av kostnader og behandling av personopplysninger);Kongen bestemmer;;;2021-0954;lov;LOV-2009-06-19-97;Landbruks- og matdepartementet;;;
18.06.2021   kl. 12.50;LOV-2021-06-18-133;Endringslov til midlertidige lover om tilpasninger i introduksjonsloven og integreringsloven;https://lovdata.no/dokument/LTI/lov/2021-06-18-133;Lov om endringer i midlertidige lover om tilpasninger i introduksjonsloven og integreringsloven for å avhjelpe konsekvenser av utbrudd av covid-19 (integreringspakke III);18.06.2021;;;2021-1045;lov;LOV-2020-05-26-53, LOV-2020-12-18-154;Kunnskapsdepartementet;;;
18.06.2021   kl. 12.50;LOV-2021-06-18-132;Endringslov til statsborgerloven og integreringsloven (endring i kravene til oppholdstid mv.);https://lovdata.no/dokument/LTI/lov/2021-06-18-132;Lov om endringer i statsborgerloven og integreringsloven (endring i kravene til oppholdstid mv.);Kongen bestemmer;;;2021-0915;lov;LOV-2005-06-10-51, LOV-2020-11-06-127;Kunnskapsdepartementet;;;
18.06.2021   kl. 12.50;LOV-2021-06-18-131;Endringslov til lov om elektronisk kommunikasjon;https://lovdata.no/dokument/LTI/lov/2021-06-18-131;Lov om endringer i lov om elektronisk kommunikasjon (lagring av IP-adresser mv.);Kongen bestemmer;;;2021-1018;lov;LOV-2003-07-04-83;Kommunal- og moderniseringsdepartementet;;;
18.06.2021   kl. 12.50;LOV-2021-06-18-130;Endringslov til plan- og bygningsloven m.m. (regional plan, dispensasjon m.m.);https://lovdata.no/dokument/LTI/lov/2021-06-18-130;Lov om endringer i plan- og bygningsloven m.m. (regional plan, dispensasjon m.m.);Kongen bestemmer;;;2021-0950;lov;LOV-2005-06-17-101, LOV-2008-06-27-71;Kommunal- og moderniseringsdepartementet;;;
18.06.2021   kl. 12.50;LOV-2021-06-18-129;Endringslov til klimaloven;https://lovdata.no/dokument/LTI/lov/2021-06-18-129;Lov om endringer i klimaloven (klimamål for 2030 og 2050);18.06.2021;;;2021-0971;lov;LOV-2017-06-16-60;Klima- og miljødepartementet;;23.06.2021 (rettelse), 25.06.2021 (rettelsestekst tatt ut), 17.08.2021 (se ny kunngjøring av beriktiget versjon av loven i kunngj. 25. juni 2021 nr. 2137);
18.06.2021   kl. 12.50;LOV-2021-06-18-128;Endringslov til straffeprosessloven og straffeloven;https://lovdata.no/dokument/LTI/lov/2021-06-18-128;Lov om endringer i straffeprosessloven og straffeloven (kriminalisering av deltakelse i kriminelle sammenslutninger);Kongen bestemmer;;;2021-1019;lov;LOV-1981-05-22-25, LOV-2005-05-20-28;Justis- og beredskapsdepartementet;;;
18.06.2021   kl. 12.50;LOV-2021-06-18-127;Endringslov til forvaltningsloven m.m.;https://lovdata.no/dokument/LTI/lov/2021-06-18-127;Lov om endringer i forvaltningsloven m.m. (utvidet adgang til informasjonsdeling);Kongen bestemmer;;;2021-1038;lov;LOV-1915-08-13-5, LOV-1966-12-16-9, LOV-1967-02-10, LOV-1987-12-18-93, LOV-1992-07-17-100, LOV-1992-12-04-132, LOV-1995-08-04-53, LOV-1996-06-21-38, LOV-1997-02-28-19, LOV-1997-06-06-32, LOV-1999-07-02-61, LOV-1999-07-16-66, LOV-2004-03-05-12, LOV-2004-05-07-21, LOV-2004-07-02-64, LOV-2005-04-01-15, LOV-2005-06-17-62, LOV-2005-06-17-64, LOV-2005-06-17-102, LOV-2006-06-16-20, LOV-2007-06-15-40, LOV-2007-06-29-44, LOV-2007-06-29-75, LOV-2007-12-21-119, LOV-2008-05-15-35, LOV-2009-06-19-44, LOV-2009-12-18-131, LOV-2011-06-24-30, LOV-2011-11-25-44, LOV-2014-06-20-49, LOV-2015-05-22-33, LOV-2017-06-16-48, LOV-2018-06-01-23, LOV-2018-06-08-28, LOV-2018-06-22-83, LOV-2019-06-21-31, LOV-2020-06-19-77;Justis- og beredskapsdepartementet;;;
18.06.2021   kl. 12.50;LOV-2021-06-18-126;Endringslov til straffeprosessloven og tvisteloven mv. (bevisforbud for patentrådgivning);https://lovdata.no/dokument/LTI/lov/2021-06-18-126;Lov om endringer i straffeprosessloven og tvisteloven mv. (bevisforbud for patentrådgivning);Kongen bestemmer;;;2021-0880;lov;LOV-1981-05-22-25, LOV-2005-06-17-90, LOV-2007-12-21-119;Justis- og beredskapsdepartementet;;;
18.06.2021   kl. 12.50;LOV-2021-06-18-125;Endringslov til smittevernloven (forlengelse av forskriftshjemmel mv.);https://lovdata.no/dokument/LTI/lov/2021-06-18-125;Lov om midlertidige endringer i smittevernloven (forlengelse av forskriftshjemmel om oppholdssted under innreisekarantene mv.);18.06.2021 – 01.12.2021;;;2021-0875;lov;LOV-2021-02-19-4, LOV-1994-08-05-55;Justis- og beredskapsdepartementet;;;
18.06.2021   kl. 12.50;LOV-2021-06-18-124;Endringslov til personopplysningsloven og offentleglova;https://lovdata.no/dokument/LTI/lov/2021-06-18-124;Lov om endringer i personopplysningsloven og offentleglova (ytrings- og informasjonsfrihet mv.);18.06.2021, Kongen bestemmer;;;2021-1037;lov;LOV-2006-05-19-16, LOV-2018-06-15-38;Justis- og beredskapsdepartementet;;;
18.06.2021   kl. 12.50;LOV-2021-06-18-123;Endringslov til politiloven;https://lovdata.no/dokument/LTI/lov/2021-06-18-123;Lov om endringer i politiloven (erstatning for skader som skyldes pålagt trening mv.);Kongen bestemmer;;;2021-1036;lov;LOV-1995-08-04-53;Justis- og beredskapsdepartementet;;;
18.06.2021   kl. 12.50;LOV-2021-06-18-122;Endringslov til straffeprosessloven mv.;https://lovdata.no/dokument/LTI/lov/2021-06-18-122;Lov om endringer i straffeprosessloven mv. (aktiv saksstyring mv.);Kongen bestemmer;;;2021-1035;lov;LOV-1915-08-13-5, LOV-1916-07-21-2, LOV-1948-12-03-7, LOV-1957-07-06-26, LOV-1961-06-16-12, LOV-1967-12-15-9, LOV-1972-06-09-31, LOV-1981-05-22-25, LOV-1985-06-21-78, LOV-1985-06-21-79, LOV-1990-06-15-27, LOV-1992-06-19-60, LOV-1993-03-12-32, LOV-1993-06-04-58, LOV-1997-02-28-19, LOV-1997-06-13-44, LOV-1997-06-13-45, LOV-1998-06-26-41, LOV-1998-07-17-61, LOV-1999-07-02-64, LOV-2000-05-12-36, LOV-2001-06-15-79, LOV-2002-03-08-4, LOV-2003-03-14-15, LOV-2003-06-06-38, LOV-2003-06-06-39, LOV-2003-06-27-64, LOV-2003-07-04-84, LOV-2004-03-05-12, LOV-2004-12-10-76, LOV-2005-05-20-28, LOV-2007-06-29-81, LOV-2009-01-09-2, LOV-2010-03-26-8, LOV-2011-06-24-29, LOV-2015-05-07-25, LOV-2015-05-07-26, LOV-2017-06-16-50;Justis- og beredskapsdepartementet;;;
18.06.2021   kl. 12.50;LOV-2021-06-18-121;Sivilombudsloven;https://lovdata.no/dokument/LTI/lov/2021-06-18-121;Lov om Stortingets ombud for kontroll med forvaltningen (sivilombudsloven);01.07.2021;;;2021-0808;lov;LOV-1962-06-22-8, FOR-1980-02-19-9862;Justis- og beredskapsdepartementet;;;
18.06.2021   kl. 12.50;LOV-2021-06-18-120;Endringslov til helse- og omsorgstjenesteloven (nytt krav til samarbeidsavtalen mellom kommuner og helseforetak);https://lovdata.no/dokument/LTI/lov/2021-06-18-120;Lov om endringer i helse- og omsorgstjenesteloven (nytt krav til samarbeidsavtalen mellom kommuner og helseforetak);Kongen bestemmer;;;2021-0940;lov;LOV-2011-06-24-30;Helse- og omsorgsdepartementet;;;
18.06.2021   kl. 12.50;LOV-2021-06-18-119;Lov om informasjonstilgang m.m. for utvalg som skal undersøke saker om overgrep begått av helsepersonell mot pasienter i perioden 2010 til 2020;https://lovdata.no/dokument/LTI/lov/2021-06-18-119;Lov om informasjonstilgang m.m. for utvalg som skal undersøke saker om overgrep begått av helsepersonell mot pasienter i perioden 2010 til 2020;18.06.2021, 16.04.2022;;;2021-1081;lov;;Helse- og omsorgsdepartementet;;;
18.06.2021   kl. 12.50;LOV-2021-06-18-118;Endringslov til helse- og omsorgstjenesteloven;https://lovdata.no/dokument/LTI/lov/2021-06-18-118;Lov om endringer i helse- og omsorgstjenesteloven (godkjenningsmodell for fritt brukervalg);Kongen bestemmer;;;2021-1020;lov;LOV-2011-06-24-30;Helse- og omsorgsdepartementet;;;
18.06.2021   kl. 12.50;LOV-2021-06-18-117;Endringslov til straffeloven;https://lovdata.no/dokument/LTI/lov/2021-06-18-117;Lov om endringer i straffeloven;Kongen bestemmer;;;2021-0948;lov;LOV-2011-06-24-30, LOV-2005-05-20-28;Helse- og omsorgsdepartementet;;;
18.06.2021   kl. 12.50;LOV-2021-06-18-116;Endringslov til helsepersonelloven (melding ved helsesvekkelse av betydning for trafikksikkerheten);https://lovdata.no/dokument/LTI/lov/2021-06-18-116;Lov om endringer i helsepersonelloven (melding ved helsesvekkelse av betydning for trafikksikkerheten);Kongen bestemmer;;;2021-0941;lov;LOV-1999-07-02-64;Helse- og omsorgsdepartementet;;;
18.06.2021   kl. 12.50;LOV-2021-06-18-115;Lov om Stortingets ombudsnemnd for Forsvaret;https://lovdata.no/dokument/LTI/lov/2021-06-18-115;Lov om Stortingets ombudsnemnd for Forsvaret;01.10.2021;;;2021-0916;lov;FOR-1952-04-21-4287;Forsvarsdepartementet;;;
18.06.2021   kl. 12.50;LOV-2021-06-18-114;Endringslov til endringslov til merverdiavgiftsloven;https://lovdata.no/dokument/LTI/lov/2021-06-18-114;Lov om endring i lov 21. desember 2020 nr. 168 om endringer i merverdiavgiftsloven;18.06.2021;;;2021-1059;lov;LOV-2009-06-19-58, LOV-2020-12-21-168;Finansdepartementet;;;
18.06.2021   kl. 12.50;LOV-2021-06-18-113;Endringslov til endringslov til skatteloven;https://lovdata.no/dokument/LTI/lov/2021-06-18-113;Lov om endringar i lov 21. desember 2020 nr. 164 om endringer i skatteloven;18.06.2021;;;2021-1058;lov;LOV-1999-03-26-14, LOV-2020-12-21-164;Finansdepartementet;;;
18.06.2021   kl. 12.50;LOV-2021-06-18-112;Endringslov til lov om midlertidig tilskuddsordning for foretak med stort omsetningsfall etter august 2020;https://lovdata.no/dokument/LTI/lov/2021-06-18-112;Lov om endring i lov om midlertidig tilskuddsordning for foretak med stort omsetningsfall etter august 2020;18.06.2021;;;2021-1057;lov;LOV-2020-12-18-156;Finansdepartementet;;;
18.06.2021   kl. 12.50;LOV-2021-06-18-111;Endringslov til lov om tilskudd ved avbrutt permittering;https://lovdata.no/dokument/LTI/lov/2021-06-18-111;Lov om endringar i lov om tilskudd ved avbrutt permittering;18.06.2021;;;2021-1056;lov;LOV-2020-06-23-99;Finansdepartementet;;;
18.06.2021   kl. 12.50;LOV-2021-06-18-110;Endringslov til folkeregisterloven;https://lovdata.no/dokument/LTI/lov/2021-06-18-110;Lov om endring i folkeregisterloven;18.06.2021;;;2021-1055;lov;LOV-2016-12-09-88;Finansdepartementet;;;
18.06.2021   kl. 12.50;LOV-2021-06-18-109;Endringslov til skatteforvaltningsloven;https://lovdata.no/dokument/LTI/lov/2021-06-18-109;Lov om endringar i skatteforvaltningsloven;18.06.2021;;;2021-1054;lov;LOV-2016-05-27-14;Finansdepartementet;;;
18.06.2021   kl. 12.50;LOV-2021-06-18-108;Endringslov til merverdiavgiftsloven;https://lovdata.no/dokument/LTI/lov/2021-06-18-108;Lov om endringar i merverdiavgiftsloven;Kongen bestemmer;;;2021-1053;lov;LOV-2009-06-19-58;Finansdepartementet;;;
18.06.2021   kl. 12.50;LOV-2021-06-18-107;Endringslov til skattebetalingsloven;https://lovdata.no/dokument/LTI/lov/2021-06-18-107;Lov om endringar i skattebetalingsloven;18.06.2021;;;2021-1052;lov;LOV-2005-06-17-67;Finansdepartementet;;;
18.06.2021   kl. 12.50;LOV-2021-06-18-106;Endringslov til merverdiavgiftskompensasjonsloven;https://lovdata.no/dokument/LTI/lov/2021-06-18-106;Lov om endring i merverdiavgiftskompensasjonsloven;18.06.2021;;;2021-1051;lov;LOV-2003-12-12-108;Finansdepartementet;;;
18.06.2021   kl. 12.50;LOV-2021-06-18-105;Endringslov til skatteloven;https://lovdata.no/dokument/LTI/lov/2021-06-18-105;Lov om endringar i skatteloven;18.06.2021, med virkning fra inntektsåret 2019 og 2021;;;2021-1049;lov;LOV-1999-03-26-14;Finansdepartementet;;;
18.06.2021   kl. 12.50;LOV-2021-06-18-104;Endringslov til Svalbardskatteloven;https://lovdata.no/dokument/LTI/lov/2021-06-18-104;Lov om endring i Svalbardskatteloven;18.06.2021;;;2021-1048;lov;LOV-1996-11-29-68;Finansdepartementet;;;
18.06.2021   kl. 12.50;LOV-2021-06-18-103;Endringslov til eigedomsskattelova;https://lovdata.no/dokument/LTI/lov/2021-06-18-103;Lov om endring i eigedomsskattelova;18.06.2021;;;2021-1047;lov;LOV-1975-06-06-29;Finansdepartementet;;;
18.06.2021   kl. 12.50;LOV-2021-06-18-102;Lov om utsettelse av fristene for å fastsette årsregnskap mv.;https://lovdata.no/dokument/LTI/lov/2021-06-18-102;Lov om utsettelse av fristene for å fastsette årsregnskap mv. og avholde ordinær generalforsamling mv. for å avhjelpe konsekvenser av utbrudd av covid-19;18.06.2021 – 10.11.2021;;;2021-1034;lov;;Finansdepartementet;;;
18.06.2021   kl. 12.50;LOV-2021-06-18-101;Endringslov til verdipapirfondloven mv.;https://lovdata.no/dokument/LTI/lov/2021-06-18-101;Lov om endringer i verdipapirfondloven mv. (gjennomføring av EØS-rett, administrative sanksjoner og andre forvaltningstiltak);Kongen bestemmer;;;2021-1061;lov;LOV-2007-06-29-75, LOV-2011-11-25-44, LOV-2015-04-10-17, LOV-2014-06-20-28;Finansdepartementet;EØS-avtalen vedlegg IXnr. 31bd (forordning (EU) nr. 345/2013 endret ved forordning (EU) 2017/1991),nr. 31be (forordning (EU) nr. 346/2013 endret ved forordning (EU) 2017/1991),nr. 31bda (forordning (EU) nr. 593/2014),nr. 31bea (forordning (EU) nr. 594/2014),nr. 31bgc (forordning (EU) 2015/760),nr. 31bgca (forordning (EU) 2018/480),nr. 31m (forordning (EU) 2017/1131),nr. 31ma (forordning (EU) 2018/708),nr. 31mb (forordning (EU) 2018/990),nr. 31bd og nr. 31be (forordning (EU) 2017/1991.;;
18.06.2021   kl. 12.50;LOV-2021-06-18-100;Endringslov til finansforetaksloven mv.;https://lovdata.no/dokument/LTI/lov/2021-06-18-100;Lov om endringer i finansforetaksloven mv. (kapitalkravs- og krisehåndteringsregler for finansforetak mv.);Kongen bestemmer;;;2021-1060;lov;LOV-1956-12-07-1, LOV-2007-06-29-75, LOV-2015-04-10-17;Finansdepartementet;EØS-avtalen vedlegg IXforordning (EU) 2019/876forordning (EU) 2020/873;;
18.06.2021   kl. 12.50;LOV-2021-06-18-99;Åpenhetsloven;https://lovdata.no/dokument/LTI/lov/2021-06-18-99;Lov om virksomheters åpenhet og arbeid med grunnleggende menneskerettigheter og anstendige arbeidsforhold (åpenhetsloven);Kongen bestemmer;;;2021-1042;lov;;Barne- og familiedepartementet;;;
18.06.2021   kl. 12.50;LOV-2021-06-18-98;Lov om Opplysningsvesenets fond;https://lovdata.no/dokument/LTI/lov/2021-06-18-98;Lov om Opplysningsvesenets fond;Kongen fastset;;;2021-1041;lov;LOV-1996-06-07-33, LOV-1996-06-07-32;Barne- og familiedepartementet;;;
18.06.2021   kl. 12.50;LOV-2021-06-18-97;Barnevernsloven;https://lovdata.no/dokument/LTI/lov/2021-06-18-97;Lov om barnevern (barnevernsloven);Kongen bestemmer;;;2021-1039;lov;LOV-1980-06-13-35, LOV-1981-04-08-7, LOV-1981-05-22-25, LOV-1991-07-04-47, LOV-1992-07-17-100, LOV-1994-08-05-55, LOV-1997-02-28-19, LOV-1997-06-19-62, LOV-1997-06-19-82, LOV-1998-06-26-41, LOV-1998-07-17-61, LOV-1999-03-26-14, LOV-1999-07-02-63, LOV-1999-07-02-64, LOV-2002-03-08-4, LOV-2003-07-04-84, LOV-2005-04-29-20, LOV-2005-05-20-28, LOV-2005-06-17-64, LOV-2005-06-17-90, LOV-2008-05-15-35, LOV-2009-06-19-44, LOV-2009-06-19-58, LOV-2009-12-18-131, LOV-2010-05-28-16, LOV-2011-06-24-30, LOV-2012-06-22-43, LOV-2014-06-06-19, LOV-2015-06-05-39, LOV-2015-09-04-85, LOV-2016-12-09-88, LOV-2017-06-16-48, LOV-2019-03-01-3, LOV-2020-11-06-127, LOV-2020-12-18-146;Barne- og familiedepartementet;;;
18.06.2021   kl. 12.50;LOV-2021-06-18-96;Endringslov til barnevernloven;https://lovdata.no/dokument/LTI/lov/2021-06-18-96;Lov om endringer i barnevernloven;Kongen bestemmer;;;2021-1040;lov;LOV-1992-07-17-100;Barne- og familiedepartementet;;;
18.06.2021   kl. 12.50;LOV-2021-06-18-95;Lov om lønnsnemndbehandling, Unio og Oslo kommune, 2021;https://lovdata.no/dokument/LTI/lov/2021-06-18-95;Lov om lønnsnemndbehandling av arbeidstvisten mellom Unio og Oslo kommune i forbindelse med mellomoppgjøret 2021;18.06.2021;;;2021-1080;lov;;Arbeids- og sosialdepartementet;;;
18.06.2021   kl. 12.50;LOV-2021-06-18-94;Lov om lønnsnemndbehandling, Unio og KS, 2021;https://lovdata.no/dokument/LTI/lov/2021-06-18-94;Lov om lønnsnemndbehandling av arbeidstvisten mellom Unio og KS i forbindelse med mellomoppgjøret 2021;18.06.2021;;;2021-1079;lov;;Arbeids- og sosialdepartementet;;;
18.06.2021   kl. 12.50;LOV-2021-06-18-93;Endringslov til arbeidsmiljøloven og diskrimineringsombudsloven;https://lovdata.no/dokument/LTI/lov/2021-06-18-93;Lov om endringer i arbeidsmiljøloven og diskrimineringsombudsloven (nemndløsning for gjengjeldelsessaker etter varsling mv.);Kongen bestemmer;;;2021-1015;lov;LOV-2005-06-17-62, LOV-2017-06-16-50;Arbeids- og sosialdepartementet;;;
18.06.2021   kl. 12.50;LOV-2021-06-18-92;Endringslov til folketrygdloven;https://lovdata.no/dokument/LTI/lov/2021-06-18-92;Lov om endringer i folketrygdloven (adgang til å ta opplæring og utdanning med dagpenger);Kongen bestemmer, 01.07.2021;;;2021-1016;lov;LOV-1997-02-28-19;Arbeids- og sosialdepartementet;;;
18.06.2021   kl. 12.50;LOV-2021-06-18-91;Endringslov til lov om aldersgrenser for offentlige tjenstemenn mv.;https://lovdata.no/dokument/LTI/lov/2021-06-18-91;Lov om endringer i lov om aldersgrenser for offentlige tjenstemenn m.fl. og lov om pensjonsordning for sykepleiere (fjerning av plikten til å fratre ved særaldersgrense);Kongen bestemmer;;;2021-0972;lov;LOV-1956-12-21-1, LOV-1962-06-22-12;Arbeids- og sosialdepartementet;;;
18.06.2021   kl. 12.50;LOV-2021-06-18-90;Endringslov til folketrygdloven;https://lovdata.no/dokument/LTI/lov/2021-06-18-90;Lov om endringer i folketrygdloven (hjelpestønad til barn under sykehusopphold og virkningstidspunkt for uføretrygd);18.06.2021, 01.07.2021;;;2021-1017;lov;LOV-1997-02-28-19;Arbeids- og sosialdepartementet;;;
18.06.2021   kl. 12.50;LOV-2021-06-18-89;Lov om Norges kontinentalsokkel;https://lovdata.no/dokument/LTI/lov/2021-06-18-89;Lov om Norges kontinentalsokkel;Kongen bestemmer;;;2021-1043;lov;LOV-1963-06-21-12, LOV-1975-06-13-35, LOV-1996-11-29-72, LOV-2019-03-22-7;Utenriksdepartementet;;;
11.06.2021   kl. 12.35;LOV-2021-06-11-88;Endringslov til vegtrafikkloven (motorsport);https://lovdata.no/dokument/LTI/lov/2021-06-11-88;Lov om endringer i vegtrafikkloven (motorsport);Kongen bestemmer;;;2021-0913;lov;LOV-1965-06-18-4;Samferdselsdepartementet;;;
